user_input,retrieved_contexts,response,reference,faithfulness,answer_relevancy,answer_correctness
"Çatı akıyor, tamir masrafına zemin kattaki dükkan katılmak zorunda mı?","['Madde 44 – Anagayrimenkulün üstüne kat ilavesi veya mevcut çekme kat yerine tam \nkat yapılması veya zemin veya bodrum katlarında veya arsanın boş kısmında 24 üncü madd e-\nnin ikinci fıkrasında yazılı yerlerin sonradan yapımı veya ilavesi için: \na) Kat malikleri kurulunun buna oybirliğiyle karar vermesi; \nb) Anagayrimenkulün bu inşaattan sonra alacağı duruma göre, yapılan yeni ilaveler de \ndahil olmak üzere bütün bağımsız bölümlerine tahsis olunacak arsa paylarının, usulüne göre \nyeniden ve oybirliğiyle tesbit edilmesi; \nc) İlave edilecek yeni bağımsız bölüme tahsis edilen arsa payı üzerinde, tapu memuru \nhuzurunda yapılacak resmi senetle, 14 üncü maddeye göre kat irtifakı kurularak bunun, ana-\ngayrimenkulün bütün bağımsız bölümlerinin kat mülkiyeti kütüğündeki irtifaklar hanesine \ntescil edilmesi ve anagayrimenkulün kapanan eski kütük sayfasiyle 13 üncü madde hükmüne \ngöre bağlantı sağlanması; \nŞarttır. \nBu nitelikteki ilave ve genişletmelere muvafakat etmekle beraber kendisi katılmak is-\ntemiyen kat maliklerinin arsa paylarında n, bu ilaveler sebebiyle azalan kısmın, ilaveyi yaptı-\nranların bağımsız bölümlerine tahsisini kabul ettikleri, resmi senette belirtilir. \nBu takdirde, yeni bağımsız bölümün yapılmasına katılmıyan kat maliklerinin arsa pay-\nlarından yeni tahsis sebebiyle azalan kısmın bedeli kendilerine ödenmek şartiyle, yeni yapılan \nbağımsız bölüm, kat irtifakı kurulmasına dair olan eski resmi senet gereğince kat mülkiyetine \nçevrilerek onu yaptıranın mülkü veya yaptıranların ortak mülkü olur ve kat mülkiyeti kütüğ ü-\nnün ayrı bir sayfasına yeni malik veya malikler adına tescil edilir. \n \nG) Temliki tasarruflar ve önemli işler:', 'Madde 5 – Kat mülkiyetinin başkasına devri veya miras yoluyla geçmesi halinde, ona \nbağlı arsa payı da birlikte geçer; arsa payı, ka t mülkiyetinden veya kat irtifakından ayrı olarak \ndevredilemiyeceği gibi, miras yoluyla da geçmez ve başka bir hakla kayıtlanamaz. \n                                                           \n1 14/11/2007 tarihli ve 5711 sayılı Kanunun 2 nci maddesiyle; bu bende ""Temeller ve ana duvarlar,"" \nibaresinden sonra gelmek üzere ""taşıyıcı sistemi oluşturan kiriş, kolon ve perde duvarlar ile taşıyıcı \nsistemin parçası diğer elemanlar,"" ibaresi eklenmiştir. \nAnagayrimenkulde, kat mülkiyetine bağlanmamış veya lehine kat irtifakı kurulmamış \narsa payı bırakılamaz. \nKat mülkiyetini kayıtlayan haklar, kendiliğinden arsa payını da kayıtlar. \nKat irtifakına konu olan arsa üzerinde bu hakla bağdaşması mümkün olmayan irtifak-\nlar kurulamaz. \nAnagayrimenkulde kat mülkiyetinin kurulmasından önce o gayrimenkulün kütükteki \nsayfasına tescil veya şerhe dilmiş olan haklar kat mülkiyetini de, kaide olarak arsa payı ora-\nnında, kendiliğinden kayıtlar. \n \nII - Bağımsız bölümlerle eklentiler ve ortak yerler arasındaki bağlantı:', '(Ek fıkra: 15/2/2018-7099/4 md.) (Değişik altıncı fıkra:9/6/2021-7327/11 md.) Yapı \nkullanma izin b elgesi düzenlenen tüm yapıların cins değişikliği işlemleri resen yapılır. Yapı \nkullanma izin belgesini düzenlemeye yetkili idare tarafından Mekânsal Adres Kayıt Sistemine \nyüklenerek elektronik ortamda kadastro müdürlüğüne gönderilen yapı kullanma izin belgesi ile \nyapı aplikasyon projesine göre kadastro müdürlüğünce tescil bildirimi düzenlenir. Tapu \nmüdürlüğüne gönderilen tescil bildirimi üzerine başkaca bir belge aranmaksızın cins değişikliği \nresen tescil edilir. Cins değişikliği yapılmış taşınmaz kat irtifakı tesisli ise, kat irtifakının tesciline \nait resmî senede ve 12 nci maddede yazılı belgelere dayalı olarak başkaca bir belge aranmaksızın \nresen kat mülkiyetine çevrilir. Bu işlemler, döner sermaye hizmet bedelinden muaftır. \n                                                           \n2 9/6/2021 tarihli ve 7327 sayılı Kanunun 11 inci maddesiyle, bu fıkranın birinci cümlesinde yer alan \n“kat karşılığı temlik sözleşmesi ve” ibaresi “kat karşılığı temlik sözleşmesi veya” şeklinde değiştirilmiş, \ncümlede yer alan “cins değişikliği,” ibaresi madde metninden çıkarılmıştır. \nKat mülkiyetine konu olmaya elverişli bir gayrimenkul üzerindeki ortaklığın giderilmesi \ndavalarında, mirasçılardan veya ortak maliklerden biri, paylaşmanın, kat mülkiyeti kurulması ve \nbağımsız bölümlerin tahsisi suretiyle yapılmasını isterse, hakim, o gayrimenkulün mülkiyetinin, \n12 nci maddede yazılı belgelere dayanılarak kat mülkiyetine çevrilmesine ve paylar denkleşti-\nrilmek suretiyle bağımsız bölümlerin ortaklara ayrı ayrı tahsisine karar verebilir. \n(Ek fıkra: 14/11/2007 -5711/3 md.) Gelirinin ortak giderlere harcanması için veya \nbaşka bir amaçla ortak yararlanmaya tahsis edilen bağımsız bölümlerin malik hanesine, bun-\nlardan yararlanan ""bağımsız bölümlerin numaraları"" yazılmak suretiyle kat mülkiyeti kütüğ ü-', 'Madde 42 – Kat malikleri,anagayrimenkulün ortak yerlerinde kendi başlarında bir deği-\nşiklik yapamazlar; ortak yerlerin düzgün veya bunları kullanmanın daha rahat ve kolay bir hale \nkonulmasına veya bu yerlerden elde edilecek faydanın çoğaltılmasına yarıyacak bütün yenilik \nve ilaveler, kat maliklerinin sayı ve arsa payı çoğunluğu ile verecekleri karar üzerine yapılır. \n(Ek fıkra: 1/7/2005 -5378/19 md.) Engellilerin yaşamı için zorunluluk göstermesi \nhâlinde, proje tadili kat maliklerinin en geç üç ay içerisinde yapacağı toplantıda görüşülerek \nsayı ve arsa payı ç oğunluğu ile karara bağlanır. Toplantının bu süre iç erisinde yapılamaması \nveya tadilat talebinin çoğunlukla kabul edilmemesi durumunda; ilgili kat malikinin talebi üze-\nrine bina güve nliğinin tehlikeye sokulmadığını bildirir komisyon raporuna istinaden ilgili \nmercilerden alınacak  tasdikli  proje değişikliği veya krokiye göre inşaat, onarım ve tesis yapı-\nlır. İlgili merciler, tasdikli proje değişikliği veya kroki taleplerini en geç altı ay içinde sonuç-\nlandırır.  Komisyonun teşkili, çalışma usûlü ile engellinin kullanımından sonraki süreç ile \nilgili usûl ve esaslar Bayındırlık ve İskan Bakanlığı ile Özürlüler İdaresi Başkanlığı tarafından \nmüştereken hazırlanacak yönetmelikle belirlenir.7 \nBu işlerin giderleri, yeniliklerden faydalananlar tarafından, faydalanma oranına göre, \nödenir. \n(Değişik dördüncü fıkra : 18/4/20 07-5627/16 md.) Kat maliklerinden birinin isteği \n                                                           \n7 25/4/2013 tarihli ve 6462 sayılı Kanunun 1 inci maddesiyle, bu fıkrada yer alan “Özürlülerin” ve \n“özürlünün” ibareleri sırasıyla “Engellilerin” ve “engellinin”  şeklinde değiştirilmiştir. \nüzerine ısı yalıtımı, ısıtma sisteminin yakıt dönüşümü ve ısıtma sisteminin merkezi sistemden \nferdi sisteme veya ferdi sistemden merkezi sisteme dönüştürülmesi, kat maliklerinin sayı ve \narsa payı çoğunl uğu i le verecekleri karar üzerine yapılır. Ancak toplam inşaat alanı ikibin', 'Madde 10 – Kat mülkiyeti ve kat irtifakı resmi senetle ve tapu siciline tescil ile doğar. \nAnagayrimenkulün tümünün mülkiyeti (Kat mülkiyeti) ne çevrilmeden o gayrimenkulün \nyalnız bir veya birkaç bölümü üzerinde kat mülkiyeti kurulamaz. \n(Değişik üçüncü fıkra: 14/11/2007 -5711/3 md.) Kat mülkiyeti kurulurken aynı katta \nbirbirine bitişik bulunan aynı nevideki birden fazla bağımsı z bölüm veya bir yapının otel, iş \nveya ticaret yeri gibi iktisadî açıdan veya kullanma bakımından bütünlük arz eden birden çok \nkatı veya böl ümü, kat mülkiyeti kütüğüne tek bağımsız bölüm olarak tescil edilebilir. Böyle \nbir tescilin yapılabilmesi için, buna uygun değişiklik projesinin ve yapı kullanma izin belgesi-\nnin Tapu Sicil Müdürlüğüne verilmiş olması gereklidir. \n(Değişik dördüncü fıkra: 15/2/2018 -7099/4 md.) Kat mülkiyetinin tescili, tapu \nmemurunca düzenlenen resmî senet uyarınca veya aşağıdaki fıkralara göre yapılabilir. \n(Ek fıkra: 15/2/2018 -7099/4 md.) Hak sahiplerine isabet eden bağımsız bölümlerin \nbelirlenmiş olması şartıyla arsa maliki ile yüklenici arasında düzenlenen kat karşılığı inşaat \nsözleşmesi, kat karşılığı temlik sözleşmesi veya  bağımsız bölümlerin taksimine ilişkin note r-\nlik sözleşmesine istinaden inşa edilecek olan binaya ilişkin (…)2 kat irtifakı ve kat mülkiyeti \ntesisi işlemi, yüklenici tarafından talep edilm esi halinde ilgili idare tarafından yapılır. Tapuya \ntescil işlemlerinde elektronik ortamda düzenlenen ve ilgili idare tarafından onaylı mimari pro-\nje ile yönetim planı esas alınır. Mimari proje ile yönetim planında malik imzası aranmaz.2 \n(Ek fıkra: 15/2/2018-7099/4 md.) (Değişik altıncı fıkra:9/6/2021-7327/11 md.) Yapı \nkullanma izin b elgesi düzenlenen tüm yapıların cins değişikliği işlemleri resen yapılır. Yapı \nkullanma izin belgesini düzenlemeye yetkili idare tarafından Mekânsal Adres Kayıt Sistemine \nyüklenerek elektronik ortamda kadastro müdürlüğüne gönderilen yapı kullanma izin belgesi ile', 'Madde 48 – Anagayrimenkulün veya anayapının tümünün veya bir kısmının harabo l-\nması halinde durum yönetici tarafından o gayrimenkulün bulunduğu yerin tapu idaresine ve \nbütün kat maliklerine; eğer yönetici yoksa, bağımsız bölümü harap olan kat maliki tarafından \ntapu idaresine derhal bildirir; bunun bildirilmemesi yüzünden doğacak zararların tümünden \nbağımsız bölümü harap olan kat maliki, zararın beşte biri oranındaki kısmından da yönetici \nmüteselsilen sorumlu olup, Hazine sorumlu değildir. \nKat mülkiyeti sona erince, kat mülkiyeti kütüğündeki sayfalar kapatılarak gayrimenku-\nlün kaydı anayapıdan sağlam kalan kısımlar gösterilmek ve kat mülkiyeti kütüğü kurulm adan \nönceki genel kütük kaydiyle bağlantı sağla nmak suretiyle, arsa payları oranında ortak mülki-\nyet esaslarına göre, genel kütüğe tescil edilir. Bu halde sigorta bedelleriyle enkaz üzerinde de \nortak mülkiyet hükümleri yürür. \nTümü harabolan anayapının arsasında malik veya ortak malikler tarafından yine kat \nmülkiyeti esasına göre yeni bir yapı yapılmak istenirse, kat irtifakı ve kat mülkiyeti kurulma-\nsına dair hükümler uygulanır. \n \nB) Kat irtifakının sona ermesi:']","634 Sayılı Kat Mülkiyeti Kanunu Madde 42 uyarınca, kat maliklerinin ortak yerlerde yapılacak değişiklikler ve onarımlar için kat malikleri kurulunun karar alması gerekmektedir. Çatı akması gibi durumlar, ortak alanların bakım ve onarımını kapsadığı için, zemin kattaki dükkanın da bu masraflara katılması gerekmektedir. Ancak, masrafların paylaşım oranı, kat maliklerinin arsa paylarına göre belirlenir. Dolayısıyla, zemin kattaki dükkan, çatı tamir masraflarına katılmak zorundadır.","634 Sayılı KMK Madde 20 uyarınca, yönetim planında aksine bir hüküm bulunmadığı sürece; çatı ortak yer sayıldığından zemin kattaki dükkan sahibi de masraflara arsa payı oranında katılmak zorundadır. Kat malikleri, kendi bölümlerinin durumu dolayısıyla ortak yerlerden faydalanmaya ihtiyaç bulunmadığını ileri sürerek bu gideri ödemekten kaçınamazlar.",0.2,0.7880271801255978,0.643155331614798
Apartman yönetim planını değiştirmek için kaç kişinin oyu gerekir?,"['Ek Madde 5 – (Ek:4/7/2019-7181/5 md.)  \nKat mülkiyetine tabi yapıların projesindeki hatalı blok numaralarının düzeltilebilmesi \niçin; blok bazında kat malikleri kurulunun salt çoğunluğuyla alınmış karar ile lisanslı harita ve \nkadastro bürosu veya kadastro müdürlüğü tarafından hazırlanan teknik rapor gereğince düzen-\nlenen ve ilgili idarece onaylanan yeni vaziyet planı ilgilisi tarafından tapu müdürlüğüne sunulur. \nKat mülkiyetine t abi yapıların projesindeki hatalı bağımsız bölüm numaralarının dü-\nzeltilebilmesi için; lisanslı harita ve kadastro bürosu veya kadastro müdürlüğü tarafından ha-\nzırlanan ve ilgili idarece onaylanan teknik rapor ilgilisi tarafından tapu müdürlüğüne sunulur. \nBu fıkra kapsamında yapılan düzeltmelerde ayni ve şahsi hak lehtarlarının muvafakati aranır. \n \nGeçici Madde 1 – (Ek:14/11/2007-5711/23 md.) (Değişik:9/6/2021-7327/13 md.)  \nBu maddenin yürürlüğe girmesinden önce yapı kullanma izin belgesi düzenlenen tüm \nyapılarda, Mekânsal Adres Kayıt Sistemine yüklenemeyen yapı kullanma izin belgesi ile yapı \naplikasyon projesinin yetkili idare tarafından elektronik ortamda kadastro müdürlüğüne \ngönderilmesi hâlinde, 10 uncu maddenin altıncı fıkrası hükümleri uyarınca işlem yapılır. \n \nGeçici Madde 2 – (Ek: 23/6/2009-5912/5 md.) \nBu Kanunun yürürlük tarihinden önce kurulan toplu yapılara ait yönetim planlarının, bu \nKanun hükümlerine uyarlanması amacıyla yapılacak ilk değişiklik için mevcut kat malikl eri \nkurulunun salt çoğunluğu yeterlidir. Mevcut toplu yapı yönetimleri, değiştirilen yönetim planına \ngöre yeni yöneticiler seçilinceye kadar geçici yönetim olarak görevini sürdürür. Toplu yapı yö-\nneticisi seçimi, en geç yönetim planının değiştirilmesini takip eden üç ay içinde yapılır. \n \nF) Yürürlük tarihi:810', 'sız bölüm sayısı kadar oy hakkına sahiptirler.  \nToplu yapı kapsamındaki ortak yapı, yer ve tesisler, bu kapsamda yer alan bağımsız \nbölüm maliklerinden oluşan toplu yapı kat malikleri kurulunca yönetilir ve yönetim tarzı, ka-\nnunların emredici hükümleri saklı kalmak şartıyla, bu kurul tarafından kararlaştırılır. Bu yetki, \nyönetim plânında toplu yapı temsilciler kuruluna verilebilir. Yönetim plânında başka türlü \ndüzenlenmemişse, toplu yapı temsilciler kurulu, blok yapılarda her blokta bulunan bağımsız \nbölüm maliklerince seçilen blok yöneticileri ve blok niteliğinde olmayan yapıların bağımsız \nbölüm maliklerince seçilen temsilcilerden oluşur. Toplu yapı temsilciler kurulu üyelerinin \nsayısı ve nasıl seçileceği toplu yapının özelliği dikkate alınarak yönetim plânında  belirtilir. \nToplu yapı temsilciler kurulu nda bu yöneticiler ve temsilciler yönettikleri ve temsil ettikleri \nbağımsız bölüm sayısı kadar oy hakkına sahiptirler.  \n \nYönetim plânı ve değiştirilmesi', 'Madde 70 – (Ek: 14/11/2007-5711/22 md.) \nToplu yapı kapsamındaki yapı ve yerler için tamamını kapsayan bir tek yönetim plânı \ndüzenlenir. Yönetim plânı, toplu yapı kapsamındaki bütün kat maliklerini bağlar. Yönetim \nplânının değiştirilebilmesi için, toplu yapı temsilciler kurulu üyelerinin temsil ettikleri bağım-\nsız bölümlerin tamsayısının beşte dördünün oyu şarttır. \nGeçici yönetimle ilgili yönetim plânı hükümleri, toplu yapı alanındaki bağımsız bölüm \nmaliklerinin beşte dördünün oylarıyla değiştirilebilir.  \n \nYönetici ve denetçi atama \nMadde 71 – (Ek: 14/11/2007-5711/22 md.) \nYönetim plânında başka türlü düzenlenmedikçe, blok kat malikleri kurulu blok için, \nblok niteliğinde olmayan yapıların yer aldığı parseldeki kat malikleri kendilerine özg ülenen \nortak yer ve tesisler için, toplu yapı temsilciler kurulu ise toplu yapı kapsamındaki bütün ortak \nyapı, yer ve tesisler için yönetici ve denetçi atar.  \nBlok yöneticisi ve denetçisi, bloktaki kat maliklerinin; blok niteliğinde olmayan yap ı-\nların ortak yer ve tesisleri için yönetici ve denetçi, bu yapılardaki kat maliklerinin sayı ve arsa \npayı bakımından çoğunluğu tarafından seçilir. Toplu yapı kapsamındaki bütün ortak yapı, yer \nve tesisler için yönetici ve denetçi ise, toplu yapı temsilciler kuruluna katılan yönetici ve tem-\nsilcilerin, yönettikleri ve temsil ettikleri bağımsız bölüm sa yısının salt çoğunluğunun oyu ile \natanır. \n \nOrtak giderlere katılma', 'Madde 69 – (Ek: 14/11/2007-5711/22 md.) \nToplu yapı kapsamında bulunan parsel ve parsellerdeki birden çok bağımsız bölümü \nkapsayan ana yapıda ortak yerleri bulunan blok yapıların her biri, kendi sorunlarına ve yalnız \no bloğa ait ortak yerlere ilişkin olarak, o blokta bulunan b ağımsız bölüm maliklerinden oluşan \nblok kat malikleri kurulunca yönetilir. Bir parselde blok niteliğinde olmayan yapılar varsa \nveya bu niteli kteki yapılarla blok yapılar aynı parselde yer alıyorsa, kendi sorunlarına ve o \nparsele ait ortak yerlere ilişkin o larak, o parselde bulunan bağımsız bölüm maliklerinden olu-\nşan kat malikleri kurulunca yönetilir. Yönetim plânında blokların ve blok niteliğinde o lmayan \nyapıların idare tarzı ayrıca belirtilir.  \nBir adada birden çok parsel yer alıyorsa, adayı oluşturan pars ellere ait ortak yerler, o \nadada bulunan bağımsız bölüm maliklerinden oluşan ada kat malikleri kurulunca yönetilir ve \nyönetim tarzı, kanunların emredici hükümleri saklı kalmak şartıyla, bu kurul tarafından karar-\nlaştırılır. Bu yetki, yönetim plânında ada te msilciler kuruluna verilebilir. Yönetim plânında \nbaşka türlü düze nlenmemişse, ada temsilciler kurulu, blok yapılarda her blokta bulunan ba-\nğımsız bölüm malikl erince seçilen blok yöneticileri ve blok niteliğinde olmayan yapıların \nbağımsız bölüm maliklerince seçilen temsilcilerden oluşur. Ada temsilciler kurulu üyelerinin \nsayısı ve nasıl seçil eceği toplu yapının özelliği dikkate alınarak yönetim plânında belirtilir. \nAda temsilciler kurulunda bu yönet iciler ve temsilciler yönettikleri ve temsil ettikleri bağım-\nsız bölüm sayısı kadar oy hakkına sahiptirler.  \nToplu yapı kapsamındaki ortak yapı, yer ve tesisler, bu kapsamda yer alan bağımsız \nbölüm maliklerinden oluşan toplu yapı kat malikleri kurulunca yönetilir ve yönetim tarzı, ka-\nnunların emredici hükümleri saklı kalmak şartıyla, bu kurul tarafından kararlaştırılır. Bu yetki,', 'Madde 67 – (Ek: 14/11/2007-5711/22 md.) \nToplu yapı kapsamında olup, bütünüyle bu kapsamdaki bağımsız bölümlerin ortak \nkullanma ve faydalanmasına tahsis edilmiş bulunan parsellerin malik hanesine, tahsis edildik-\nleri toplu yapı kapsamındaki diğer parsellerin ada, parsel, blok ve bağımsız bölüm numaraları \ngösterilmek suretiyle tapu siciline kaydedilir ve bu suretle tahsis edildikleri parsellerde bulu-\nnan bağımsız bölümlerin ortak yeri olur. \n                                                           \n10 14/11/2007 tarihli ve 5711 sayılı Kanunun 22 nci maddesiyle; 65 inci maddeden sonra gelmek üzere \n""Toplu Yapılara İlişkin Özel Hükümler"" başlıklı ""Dokuzuncu Bölüm"" altında aşağıdaki maddeler ek-\nlenmiş, mevcut 66 ve 67 nci maddeler, 75 ve 76 ncı maddeler olarak teselsül ettirilmiştir. \nToplu yapı kapsamında bulunan birden çok yapının ortak sosyal ve alt yapı tesisleri \nbulundukları parsel veya yapıya bakılmaksızın, tahsis edildikleri bağımsız bölümlerin ortak \nyeri sayılır. \n \nVaziyet plân ve projeleri \nMadde 68 – (Ek: 14/11/2007-5711/22 md.) \nToplu yapılarda; yapıların konumları, ortak nitelikteki yerler ve tesisler, bunların kul-\nlanılış amaç ve şekilleri, toplu yapı kapsamındaki parsel veya parsellerin tamamını kapsaya-\ncak şeki lde, bir bütün olarak ilgili makamlarca onaylanmış imar plânı hükümlerine uygun  \nolarak hazırlanmış vaziyet plânında ve projelerde belirtilir.  \nKamuya ayrılan yerlerin düzenlenmesi, işletilmesi ve bakımı, bu konuda yetkili kamu \nkurumu ile mutabakat sağlanması hâlinde, kamunun kullanımını kısıtlamamak şartıyla toplu \nyapı yönetimince üstlenilebilir. \nToplu yapı uygulamasında, kat mülkiyetinin ve kat irtifakının tesisine, aranacak belge-\nlere, tapuda yapılacak işlemlere ilişkin hususlar, Bayındırlık ve İskân Bakanlığınca hazırlana-\ncak bir yönetmelikle düzenlenir. \n \nYönetim', '(Ek fıkra: 15/2/2018-7099/4 md.) (Değişik altıncı fıkra:9/6/2021-7327/11 md.) Yapı \nkullanma izin b elgesi düzenlenen tüm yapıların cins değişikliği işlemleri resen yapılır. Yapı \nkullanma izin belgesini düzenlemeye yetkili idare tarafından Mekânsal Adres Kayıt Sistemine \nyüklenerek elektronik ortamda kadastro müdürlüğüne gönderilen yapı kullanma izin belgesi ile \nyapı aplikasyon projesine göre kadastro müdürlüğünce tescil bildirimi düzenlenir. Tapu \nmüdürlüğüne gönderilen tescil bildirimi üzerine başkaca bir belge aranmaksızın cins değişikliği \nresen tescil edilir. Cins değişikliği yapılmış taşınmaz kat irtifakı tesisli ise, kat irtifakının tesciline \nait resmî senede ve 12 nci maddede yazılı belgelere dayalı olarak başkaca bir belge aranmaksızın \nresen kat mülkiyetine çevrilir. Bu işlemler, döner sermaye hizmet bedelinden muaftır. \n                                                           \n2 9/6/2021 tarihli ve 7327 sayılı Kanunun 11 inci maddesiyle, bu fıkranın birinci cümlesinde yer alan \n“kat karşılığı temlik sözleşmesi ve” ibaresi “kat karşılığı temlik sözleşmesi veya” şeklinde değiştirilmiş, \ncümlede yer alan “cins değişikliği,” ibaresi madde metninden çıkarılmıştır. \nKat mülkiyetine konu olmaya elverişli bir gayrimenkul üzerindeki ortaklığın giderilmesi \ndavalarında, mirasçılardan veya ortak maliklerden biri, paylaşmanın, kat mülkiyeti kurulması ve \nbağımsız bölümlerin tahsisi suretiyle yapılmasını isterse, hakim, o gayrimenkulün mülkiyetinin, \n12 nci maddede yazılı belgelere dayanılarak kat mülkiyetine çevrilmesine ve paylar denkleşti-\nrilmek suretiyle bağımsız bölümlerin ortaklara ayrı ayrı tahsisine karar verebilir. \n(Ek fıkra: 14/11/2007 -5711/3 md.) Gelirinin ortak giderlere harcanması için veya \nbaşka bir amaçla ortak yararlanmaya tahsis edilen bağımsız bölümlerin malik hanesine, bun-\nlardan yararlanan ""bağımsız bölümlerin numaraları"" yazılmak suretiyle kat mülkiyeti kütüğ ü-']","634 Sayılı Kat Mülkiyeti Kanunu Madde 70 uyarınca, yönetim planının değiştirilebilmesi için toplu yapı temsilciler kurulu üyelerinin temsil ettikleri bağımsız bölümlerin tamsayısının beşte dördünün oyu şarttır. Bu durumda, yönetim planının değiştirilmesi için gerekli olan oy oranı, kat maliklerinin temsil ettikleri bağımsız bölümlerin sayısına bağlı olarak belirlenmektedir.","634 Sayılı KMK Madde 28 uyarınca, yönetim planının değiştirilmesi için bütün kat maliklerinin beşte dördünün (4/5) oyu şarttır. Bu hüküm emredici olup yönetim planı ile değiştirilemez.",0.5,0.455303990007046,0.19147728206629577
Kat malikleri toplantısı ne zaman yapılır?,"['Madde 29 – Kat malikleri kurulu, yılda bir defadan az olmamak üzere yönetim pla-\nnında gösterilen zamanlarda, eğer böyle bir zaman gösterilmemişse, her takvim yılının  ilk ayı \niçinde toplanır. (Ek cümle: 14/11/2007-5711/14 md.) Toplu yapılarda ise kurullar, en geç iki \nyılda bir defadan az olmamak üzere yönetim plânlarında gösterilen zamanlarda, böyle bir za-\nman gösterilmemişse, ikinci takvim yılının ilk ayı içinde toplanır.  \nÖnemli bir sebebin çıkması halinde, yöneticinin veya denetçinin veya kat maliklerin-\nden üçte birinin istemi üzerine ve toplantı için istenilen tarihten en az onbeş gün önce bütün \nkat maliklerine imzalattırılacak bir çağrı veya bir taahhütlü mektupla, t oplantı sebebi de bildi-\nrilmek şartiyle, kat malikleri kurulu her zaman toplanabilir. \nİlk çağrı yapılırken, birinci toplantıda, yeter sayının sağlanamaması halinde, ikinci top-\nlantının nerede ve hangi tarihte yapılacağı da belirtilir.  (Ek cümle: 14/11/2007-5711/14 md.) \nİlk toplantı ile ikinci toplantı arasında bırakılacak zaman yedi günden az olamaz. \n \nII - Yeter sayı: \nMadde 30 – Kat malikleri kurulu, kat maliklerinin sayı ve arsa payı bakımından yarı-\nsından fazlasiyle toplanır ve oy çokluğuyla karar verir. \n(Değişik ikinci fıkra: 14/11/2007 -5711/15 md.) Yeter sayının sağlanamaması nede-\nniyle ilk toplantının yapılamaması halinde, ikinci toplantı, en geç onbeş gün sonra yapılır. Bu \ntoplantıda karar yeter sayısı, katılanların salt çoğunluğudur. \nBu kanunda yeter sayı için ayrıca konulmuş olan hükümler saklıdır. \n \nIII - Oya katılma:', 'Madde 27 – Anagayrimenkul, kat malikleri kurulunca yönetilir ve yönetim tarzı,  ka-\nnunların emredici hükümleri saklı kalmak şartiyle, bu kurul tarafından kararlaştırılır. \n \nB) Yönetim planı: \nMadde 28 – Yönetim planı yönetim tarzını, kullanma maksat ve şeklini yönetici ve \ndenetçilerin alacakları ücreti ve yönetime ait diğer hususları dü zenler.Yönetim planı, bütün \nkat maliklerini bağlıyan bir sözleşme hükmündedir. \nYönetim planında hüküm bulunmıyan hallerde, anagayrimenkulün yönetiminden do-\nğacak anlaşmazlıklar bu kanuna ve genel hükümlere göre karara bağlanır. \n(Değişik: 13/4/1983 - 2814/11 md.) Yönetim planının değiştirilmesi için bütün kat \nmaliklerinin beşte dördünün oyu şarttır. Kat maliklerinin 33 üncü maddeye göre mahkemeye \nbaşvurma hakları saklıdır. \nYönetim planı ve bunda yapılan değişiklikler, bütün kat malikleriyle onların külli ve \ncüzi haleflerini ve yönetici ve denetçileri bağlar. \nYönetim planının ve onda sonradan yapılan değişikliklerin tarihi, kat mülkiyeti kütü-\nğünün (Beyanlar) hanesinde gösterilir ve bu değişiklikler yönetim planına bağlanarak kat \nmülkiyetinin kuruluş belgeleri arasında saklanır. \n \nC) Kat malikleri kurulunun toplantısı ve kararları: \nI - Toplantı zamanı:', 'Madde 41 – Kat malikleri kurulu, yöneticinin bu görevdeki tutumunu devamlı olarak \ndenetler ve haklı bir sebebin çıkması halinde onu her zaman değiştirebilir. \nHesapların denetlenmesi için yönetim planında, belli bir zaman konul mamışsa; bu de-\nnetim her üç ayda bir yapılır; bununla beraber haklı bir sebep çıkarsa, hesap denetlenmesi her \nzaman yapılabilir. \nKat malikleri kurulu denetim işini, kendi aralarından sayı ve arsa payı çoğunluğuyla \nseçecekleri bir denetçiye veya üç kişilik b ir denetim kuruluna verebilir; bu halde denetçi veya \ndenetim kurulu yönetim planında yazılı zama nlarda, eğer zaman yazılmamışsa, her takvim \nyılının birinci ayı içinde kat malikleri kuruluna verecekleri bir raporla denetimin sonucunu ve \nanagayrimenkulün yönetim tarzı hakkındaki düşüncelerini bildirir; bu rapor çoğaltılarak birer \nörneği taahhütlü mektupla kat maliklerine gönderilir. \nDenetçiler bu raporu ve verecekleri kararları ve gerekli gördükleri diğer hususları, (1) \nden başlayıp sıra ile giden sayfa numar aları taşıyan ve her sayfası noter mührüyle tasdikli bir \ndeftere geçirip tarih koyarak altını imza ederler. \n \nF) Yenilik ve ilaveler: \nI - Faydalı olanlar:', 'bankada kendi adına ve fakat anagayrimenkulün yönetici sıfatı gösterilmek suretiyle, hesap \naçtırılması; \nk) Kat malikleri kurulunun toplantıya çağırılması. \nl) (Ek: 4/4/2015 -6645/82 md.) Anagayrimenkulde bulunan asansörlerin güvenli bir \nşekilde işletilmesinin sağlanması amacıyla aylık bakımları ile yıllık kontrollerinin ilgili teknik \ndüzenlemelere uygun şekilde yaptırılması ve bu işlemlere ilişkin ücretlerin ödenmesi. \n(Ek fıkra: 4/4/2015-6645/82 md.) Bu Kanunun 34 üncü maddesinde belirtilen şartları \ntaşımasına rağmen yönetici ataması yapılmayan anagayrimenkulde, birinci fıkrada sayılan \nişlerin yaptırılmasından kat malikleri müştereken sorumludur. \n \n2. Defter tutulması ve belgelerin saklanması:', 'Madde 33 – (Değişik birinci fıkra: 14/11/2007-5711/17 md.) Kat malikleri kurulunca \nverilen kararlar aleyhine, kurul toplantısına katılan ancak 32 nci madde hükmü gereğince aykırı \noy kullanan her kat maliki karar tarihinden başlayarak bir ay içinde, toplantıya katılmayan her \nkat maliki kararı öğrenmesinden başlayarak bir ay içinde ve her halde karar tarihinden başlaya-\nrak altı ay içinde anagayrimenkulün bulunduğu yerdeki sulh mahkemesine iptal davası açabilir; \nkat malikleri kurulu kararlarının yok veya mutlak butlanla hükümsüz sayıldığı durumlarda süre \nkoşulu aranmaz. Kat maliklerinden birinin yahut onun katından kira akdine, oturma hakkına \nveya başka bir sebebe dayanarak devamlı surette faydalanan kimsenin, borç ve yükümlerin i \nyerine getirmemesi yüzünden zarar gören kat maliki veya kat malikleri, anagayrimenkulün bu-\nlunduğu yerin sulh mahkemesine başvurarak hâkimin müdahalesini isteyebilir. \nHakim, ilgilileri dinledikten sonra, bu kanuna ve yönetim planına ve bunlarda bir h ü-\nküm yoksa, genel hükümlere ve hakkaniyet kaidelerine göre derhal kararını verir ve bunun, \ntesbit edeceği kısa bir süre içinde yerine getirilmesi lüzumunu ilgiliye tefhim veya tebliğ eder. \n(Değişik üçüncü fıkra: 14/11/2007 -5711/17 md.) Tespit edilen süre içinde  hâkimin \nkararını yerine getirmeyenlere, aynı mahkemece, ikiyüz elli Türk Lirasından ikibin Türk Lira-\nsına kadar idarî para cezası verilir. 25 inci madde hükmü saklıdır. \n \nD) Yönetici: \nI - Atanması:', 'Madde 36 – Yönetici, kat malikleri kurulunun kararlarını protokolleri, yapılan ihtar ve \ntebligatın özetini ve tarihlerini ve bütün giderleri, 32 nci maddede sözü geçen deftere tarih \nsırasiyle yazmaya ve bu defteri ve giderlerin belgeleriyle  diğer bütün belgeleri bir dosyada \nsaklamaya mecburdur.  \nBu defterin, her takvim yılının bitmesinden başlıyarak bir ay içinde yönetici tarafından \nnotere kapattırılması mecburidir. \nBu maddede yazılı görevleri yerine getirmiyen yöneticiye 33 üncü maddenin so n fık-\nrasında yazılı cezalar uygulanır.  \n \n3. İşletme projesinin yapılması: \nMadde 37 – (Değişik: 13/4/1983 - 2814/12 md.) \nKat malikleri kurulunca kabul edilmiş işletme projesi yoksa, yönetici gecikmeksizin \nbir işletme projesi yapar. \nBu projede özellikle: \na) Anagayrimenkulün bir yıllık yönetiminde  tahmini olarak gelir ve gider tutarları; \nb) Tüm giderlerden her kat malikine, bu Kanunun 20 nci maddesindeki esaslara göre \ndüşecek tahmini miktar; \nc) Tahmini giderlerle diğer muhtemel giderleri karşılamak üzere her kat malikinin 20 \nnci maddedeki esaslara göre vermesi gereken avans tutarı; \nGösterilir. \nBu proje,kat maliklerine veya bağımsız bölümden fiilen yararlananlara, imzaları karşı-\nlığında veya taahhütlü mektupla bildirilir. Bildirimden başlayarak yedi gün içinde p rojeye \nitiraz edilirse durum kat malikleri kurulunda incelenir ve proje hakkında, karar verilir, gere-\nkirse yeni bir proje hazırlanır. \nKesinleşen işletme projeleri veya kat malikleri kurulunun işletme giderleri ile ilgili karar-\nları, İcra ve İflas Kanununun 68 inci maddesinin 1 inci fıkrasında belirtilen belgelerden sayılır. \n \nIII - Sorumluluğu: \n1.Genel kural:']","634 Sayılı Kat Mülkiyeti Kanunu Madde 29 uyarınca, kat malikleri kurulu, yılda bir defadan az olmamak üzere yönetim planında belirtilen zamanlarda, eğer böyle bir zaman gösterilmemişse, her takvim yılının ilk ayı içinde toplanır. Toplu yapılarda ise kurullar, en geç iki yılda bir defadan az olmamak üzere yönetim planlarında gösterilen zamanlarda, böyle bir zaman gösterilmemişse, ikinci takvim yılının ilk ayı içinde toplanır. Ayrıca, önemli bir sebep çıkması halinde, yöneticinin veya denetçinin ya da kat maliklerinden üçte birinin istemi üzerine, toplantı için istenilen tarihten en az onbeş gün önce çağrı yapılmak suretiyle kat malikleri kurulu her zaman toplanabilir.","634 Sayılı KMK Madde 29 uyarınca, yönetim planında aksine bir zaman gösterilmemişse, kurul her takvim yılının ilk ayı içinde toplanır.",1.0,0.31864650587972104,0.3874739078283673
"Komşum evini randevu evi veya kumarhane olarak kullanıyor, ne yapabiliriz?","['ğince verilen emre rağmen, bu kanunda yazılı borç ve yükümleri yerine getirmemek suretiyle \nöteki kat maliklerinin haklarını ihlal etmekte devamlı olarak bir yıl ısrar edilmesi; \nc) Kendi bağımsız bölümünü randevu evi veya kumarhane veya benzeri yer olarak \nkullanmak suretiyle ahlak ve adaba aykırı harekette bulunması.  \n(Değişik dördüncü fıkra: 14/11/2007-5711/12 md.) Bu maddedeki dava hakkı, devir \nkonusunda kat maliklerince alınan dava açma kararının öğrenilmesi tarihinden başlay arak altı \nay ve her halde dava hakkının doğumundan başlayarak beş yıl içinde kullanı lmazsa veya dava \nsebebi ortadan kalkmışsa düşer. \n \nB) Kat irtifakı sahiplerinin borçları:', '(Ek fıkra: 15/2/2018-7099/4 md.) (Değişik altıncı fıkra:9/6/2021-7327/11 md.) Yapı \nkullanma izin b elgesi düzenlenen tüm yapıların cins değişikliği işlemleri resen yapılır. Yapı \nkullanma izin belgesini düzenlemeye yetkili idare tarafından Mekânsal Adres Kayıt Sistemine \nyüklenerek elektronik ortamda kadastro müdürlüğüne gönderilen yapı kullanma izin belgesi ile \nyapı aplikasyon projesine göre kadastro müdürlüğünce tescil bildirimi düzenlenir. Tapu \nmüdürlüğüne gönderilen tescil bildirimi üzerine başkaca bir belge aranmaksızın cins değişikliği \nresen tescil edilir. Cins değişikliği yapılmış taşınmaz kat irtifakı tesisli ise, kat irtifakının tesciline \nait resmî senede ve 12 nci maddede yazılı belgelere dayalı olarak başkaca bir belge aranmaksızın \nresen kat mülkiyetine çevrilir. Bu işlemler, döner sermaye hizmet bedelinden muaftır. \n                                                           \n2 9/6/2021 tarihli ve 7327 sayılı Kanunun 11 inci maddesiyle, bu fıkranın birinci cümlesinde yer alan \n“kat karşılığı temlik sözleşmesi ve” ibaresi “kat karşılığı temlik sözleşmesi veya” şeklinde değiştirilmiş, \ncümlede yer alan “cins değişikliği,” ibaresi madde metninden çıkarılmıştır. \nKat mülkiyetine konu olmaya elverişli bir gayrimenkul üzerindeki ortaklığın giderilmesi \ndavalarında, mirasçılardan veya ortak maliklerden biri, paylaşmanın, kat mülkiyeti kurulması ve \nbağımsız bölümlerin tahsisi suretiyle yapılmasını isterse, hakim, o gayrimenkulün mülkiyetinin, \n12 nci maddede yazılı belgelere dayanılarak kat mülkiyetine çevrilmesine ve paylar denkleşti-\nrilmek suretiyle bağımsız bölümlerin ortaklara ayrı ayrı tahsisine karar verebilir. \n(Ek fıkra: 14/11/2007 -5711/3 md.) Gelirinin ortak giderlere harcanması için veya \nbaşka bir amaçla ortak yararlanmaya tahsis edilen bağımsız bölümlerin malik hanesine, bun-\nlardan yararlanan ""bağımsız bölümlerin numaraları"" yazılmak suretiyle kat mülkiyeti kütüğ ü-', 'bankada kendi adına ve fakat anagayrimenkulün yönetici sıfatı gösterilmek suretiyle, hesap \naçtırılması; \nk) Kat malikleri kurulunun toplantıya çağırılması. \nl) (Ek: 4/4/2015 -6645/82 md.) Anagayrimenkulde bulunan asansörlerin güvenli bir \nşekilde işletilmesinin sağlanması amacıyla aylık bakımları ile yıllık kontrollerinin ilgili teknik \ndüzenlemelere uygun şekilde yaptırılması ve bu işlemlere ilişkin ücretlerin ödenmesi. \n(Ek fıkra: 4/4/2015-6645/82 md.) Bu Kanunun 34 üncü maddesinde belirtilen şartları \ntaşımasına rağmen yönetici ataması yapılmayan anagayrimenkulde, birinci fıkrada sayılan \nişlerin yaptırılmasından kat malikleri müştereken sorumludur. \n \n2. Defter tutulması ve belgelerin saklanması:', 'Madde 44 – Anagayrimenkulün üstüne kat ilavesi veya mevcut çekme kat yerine tam \nkat yapılması veya zemin veya bodrum katlarında veya arsanın boş kısmında 24 üncü madd e-\nnin ikinci fıkrasında yazılı yerlerin sonradan yapımı veya ilavesi için: \na) Kat malikleri kurulunun buna oybirliğiyle karar vermesi; \nb) Anagayrimenkulün bu inşaattan sonra alacağı duruma göre, yapılan yeni ilaveler de \ndahil olmak üzere bütün bağımsız bölümlerine tahsis olunacak arsa paylarının, usulüne göre \nyeniden ve oybirliğiyle tesbit edilmesi; \nc) İlave edilecek yeni bağımsız bölüme tahsis edilen arsa payı üzerinde, tapu memuru \nhuzurunda yapılacak resmi senetle, 14 üncü maddeye göre kat irtifakı kurularak bunun, ana-\ngayrimenkulün bütün bağımsız bölümlerinin kat mülkiyeti kütüğündeki irtifaklar hanesine \ntescil edilmesi ve anagayrimenkulün kapanan eski kütük sayfasiyle 13 üncü madde hükmüne \ngöre bağlantı sağlanması; \nŞarttır. \nBu nitelikteki ilave ve genişletmelere muvafakat etmekle beraber kendisi katılmak is-\ntemiyen kat maliklerinin arsa paylarında n, bu ilaveler sebebiyle azalan kısmın, ilaveyi yaptı-\nranların bağımsız bölümlerine tahsisini kabul ettikleri, resmi senette belirtilir. \nBu takdirde, yeni bağımsız bölümün yapılmasına katılmıyan kat maliklerinin arsa pay-\nlarından yeni tahsis sebebiyle azalan kısmın bedeli kendilerine ödenmek şartiyle, yeni yapılan \nbağımsız bölüm, kat irtifakı kurulmasına dair olan eski resmi senet gereğince kat mülkiyetine \nçevrilerek onu yaptıranın mülkü veya yaptıranların ortak mülkü olur ve kat mülkiyeti kütüğ ü-\nnün ayrı bir sayfasına yeni malik veya malikler adına tescil edilir. \n \nG) Temliki tasarruflar ve önemli işler:', 'Madde 23 – Kat maliklerinden birinin bağımsız bölümünde veya bu bölümdeki tesis-\nlerde meydana gelen bir hasar veya bozukluğun onarımı veya giderilmes i veya tesislerin ye-\nniden yapılması ile yapı güvenliğiyle ilgili olarak yapılması gerekli görülen teknik inceleme-\nler için diğer bir bağımsız bölüme girmek gerekiyorsa, o bölümün maliki veya o bölümde \nbaşka sıfatla otura nlar, giriş müsaadesi vermeye ve böl ümde gerekli işlerin yapılmasına ka t-\nlanmaya mecburdurlar.6 \n                                                           \n6 14/11/2007 tarihli ve 5711 sayılı Kanunun 11 inci maddesiyle; bu fıkrada yer alan ""tesislerin yeniden \nyapılması"" ibaresinden sonra gelmek üzere ""ile yapı güvenliğiyle ilgili olarak yapılması gerekli görülen \nteknik incelemeler"" ibaresi eklenmiştir. \nAnagayrimenkulün bir kısmının harap olması halinde, harap olan bağımsız bölüm ve \neklentilerinin veya ortak yerlerin veya bağımsız bölümdeki tesislerin yeniden yapılması için, \nsağlam kalan bağımsız bölümlerin içinden veya dışından faydalanılması gerekiyorsa, o bö-\nlümlerin malikleri veya orada başka sıfatla oturanlar buna müsaade etmeye mecburdurlar. \nYukarıdaki fıkralarda yazılı müsaade yüzünden, kat maliklerinin veya orada başka sı-\nfatla oturanların uğrayacakları zararı, lehine müsaade verilen bağımsız bölüm malikleri derhal \nödemekle yükümlüdürler.  \n \nVII - Yasak işler:', 'Madde 13 – (Değişik birinci fıkra: 13/4/1983 -2814/5 md.) Tapu memuru kendisine \nverilen belgelerin tamam ve usulüne uygun ve dilekçeyi verenlerin veya istemde bulunanların \nyetkili olduklarına kanaat getirdikten sonra, kat mülkiyeti veya kat irtifakı kurulmasına dair \nresmi sözleşmeyi düzenler. Bu sözleşme aynı zamanda tescil istemi sayılır. \n(Değişik ikinci fıkra: 14/11/2007-5711/6 md.) Sözleşme düzenlenince kat irtifakının \nkat mülkiyetine çevrilmesinde kat irtifakının kayıtlı olduğu kat mülkiyeti kütüğü sayfasındaki, \ndoğrudan doğruya kat mülkiyetinin kur ulması halinde ise anagayrimenkulün kayıtlı bulund u-\nğu tapu kütüğü sayfasındaki mülkiyet hanesine ""Bu gayrimenkulün mülkiyeti kat mülkiyetine \nçevrilmiştir."" ibaresi yazılarak, sayfa anagayrimenkulün leh ve aleyhine tesis edilecek irtifak \nhakları dışı ndaki i şlemlere kapatılır ve kat mülkiyetine konu olan her bağımsız bölüm, kat \nmülkiyeti kütüğünün ayrı bir sayfasına o bölüme bağlı arsa payı ve anagayrimenkulün kayıtlı \nbulunduğu genel kütükteki pafta, ada, parsel, defter ve sayfa numaraları gösterilmek suretiy le \ntescil edilir; anaga yrimenkulün kayıtlı bulunduğu genel kütük sayfasına da, bağımsız bölüm-\nlerin kat mülkiyeti küt üğündeki defter ve sayfa numaraları işlenmek suretiyle, kütükler ar a-\nsında bağlantı sağlanır. \n(Değişik üçüncü fıkra: 14/11/2007-5711/6 md.) Anagayrimenkulün sayfasında evvelce \nmevcut olan haklara ait sicil kaydı, irtifak hakları hariç, bağımsız bölümlerin kat mülkiyeti kü-\ntüğündeki sayfasına geçirilir. Anagayrimenkulün mülkiyetinin kat mülkiyetine çevrilmesinden \nsonra, anagayrimenkulün leh ve al eyhine tesis edilecek irtifak hakları da anagayrimenkulün \ntapu kütüğü sayfasına tescil edilir ve kat mülkiyeti kütüğünün beyanlar hanesinde belirtilir. \nKat mülkiyeti kütüğüne tescil edilen her bağımsız bölüm ayrı bir gayrimenkul niteliği-\nni kazanır ve kütükte o bölümün tasdikli planındaki numarayı alır.']","634 Sayılı Kat Mülkiyeti Kanunu Madde 13 uyarınca, komşunuzun bağımsız bölümünü randevu evi veya kumarhane gibi ahlak ve adaba aykırı bir şekilde kullanması durumunda, diğer kat maliklerinin haklarını ihlal ettiği kabul edilir. Bu durumda, kat malikleri, bu durumu düzeltmek için kat malikleri kurulunda toplanarak gerekli kararları alabilir ve mahkemeye başvurarak durumu düzeltebilirler. Dava açma hakkı, bu tür bir ihlalin öğrenilmesinden itibaren altı ay içinde kullanılmalıdır.","634 Sayılı KMK Madde 25 uyarınca, dairesini ahlak ve adaba aykırı şekilde randevu evi veya kumarhane olarak kullanan malike karşı diğer malikler, mülkiyet hakkının kendilerine devredilmesini hakimden talep edebilirler.",0.25,0.2946210403569257,0.3996450700009695
"Kiracıyım, kirayı en geç ne zaman ödemem gerekir?","['ya\t da\tönemli\t ölçüde\t engellemesi\t ve\t verilen\t sürede\t giderilmemesi\t hâlinde\t kiracı,\t sözleşmeyi\tfeshedebilir. Kiraya veren, kiralanandaki ayıbı gidermek yerine, uygun bir süre içinde ayıpsız benzeriyle değiştirebilir. Kiraya veren, kiracıya aynı malın ayıpsız bir benzerini hemen vererek ve uğradığı zararın tamamını gidererek, onun seçimlik haklarını kullanmasını önleyebilir.', 'D. Kiracının borçları I. Kira bedelini ödeme borcu 1. Genel olarak MADDE\t313-\tKiracı, kira bedelini ödemekle yükümlüdür. \t 2. İfa zamanı MADDE\t 314-\tKiracı, aksine sözleşme ve yerel âdet olmadıkça, kira bedelini ve gerekiyorsa yan giderleri, her ayın sonunda ve en geç kira süresinin bitiminde ödemekle yükümlüdür.   3. Kiracının temerrüdü MADDE\t 315-\tKiracı, kiralananın tesliminden sonra muaccel olan kira bedelini veya yan gideri ödeme borcunu ifa etmezse, kiraya veren kiracıya yazılı olarak bir süre verip, bu sürede de ifa etmeme durumunda, sözleşmeyi feshedeceğini bildirebilir. Kiracıya verilecek süre en az on gün, konut ve çatılı işyeri kiralarında ise en az otuz gündür. Bu süre, kiracıya yazılı bildirimin yapıldığı tarihi izleyen günden itibaren işlemeye başlar.   II. Özenle kullanma ve komşulara saygı gösterme borcu MADDE\t 316-\tKiracı, kiralananı, sözleşmeye uygun olarak özenle kullanmak ve kiralananın bulunduğu taşınmazda oturan kişiler ile komşulara gerekli saygıyı göstermekle yükümlüdür. Kiracının bu yükümlülüğüne aykırı davranması durumunda kiraya veren, konut ve çatılı işyeri kirasında, en az otuz gün süre vererek, aykırılığın giderilmesi, aksi takdirde sözleşmeyi feshedeceği konusunda yazılı bir ihtarda bulunur. Diğer kira ilişkilerinde ise, kiraya veren, kiracıya önceden bir ihtarda bulunmaksızın, yazılı bir bildirimle sözleşmeyi hemen feshedebilir. Konut\tve\tçatılı\tişyeri\tkirasında,\tkiracının\tkiralanana\tkasten\tağır\tbir\tzarar\tvermesi,\tkiracıya\tverilecek\tsürenin\tyararsız\tolacağının\tanlaşılması\tveya\tkiracının\tbu\tyükümlülüğe\taykırı\t davranışının\t kiraya\t veren\t veya\t aynı\t taşınmazda\t oturan\t kişiler\t ile\t komşular\tbakımından\tçekilmez\tolması\tdurumlarında\tkiraya\tveren,\tyazılı\tbir\tbildirimle\tsözleşmeyi\themen\tfeshedebilir. \t III. Temizlik ve bakım giderlerini ödeme borcu MADDE\t 317- Kiracı, kiralananın olağan kullanımı için gerekli temizlik ve bakım giderlerini ödemekle yükümlüdür. Bu konuda yerel âdete de bakılır.', '3. Yapı malikinin sorumluluğu a. Giderim yükümlülüğü MADDE\t 69- Bir binanın veya diğer yapı eserlerinin maliki, bunların yapımındaki bozukluklardan veya bakımındaki eksikliklerden doğan zararı gidermekle yükümlüdür. İntifa ve oturma hakkı sahipleri de, binanın bakımındaki eksikliklerden doğan zararlardan, malikle birlikte müteselsilen sorumludurlar. Sorumluların, bu sebeplerle kendilerine karşı sorumlu olan diğer kişilere rücu hakkı saklıdır.   b. Zarar tehlikesini önleme MADDE\t 70- Bir başkasına ait bina veya\t diğer\t yapı\t eserlerinden\t zarar\t görme\ttehlikesiyle\tkarşılaşan\tkişi, bu tehlikenin giderilmesi için gerekli önlemlerin alınmasını hak sahiplerinden isteyebilir. Kişilerin\tve\tmalların\tkorunması\thakkındaki\tkamu\thukuku\tkuralları\tsaklıdır.  2. Kiralananın sonradan ayıplı hâle gelmesinden sorumluluk a. Genel olarak MADDE\t 305-\tKiralanan sonradan ayıplı duruma gelirse kiracı, kiraya verenden ayıpların giderilmesini veya kira bedelinden ayıpla orantılı bir indirim yapılmasını ya da zararının giderilmesini isteyebilir. Ancak, zararın giderilmesi istemi diğer seçimlik hakların kullanılmasını önlemez. Önemli ayıp durumunda kiracının sözleşmeyi fesih hakkı saklıdır.   b. Ayıbın giderilmesini isteme ve fesih MADDE\t 306-\tKiracı, kiraya verenden kiralanandaki ayıbın uygun bir sürede giderilmesini isteyebilir; bu sürede ayıp giderilmezse kiracı, ayıbı kiraya veren hesabına gidertebilir ve bundan doğan alacağını kira bedelinden indirebilir veya kiralananın ayıpsız bir benzeri ile değiştirilmesini isteyebilir. Ayıbın,\t kiralananın\t öngörülen\t kullanıma\t elverişliliğini\t ortadan\t kaldırması\t ya\t da\tönemli\t ölçüde\t engellemesi\t ve\t verilen\t sürede\t giderilmemesi\t hâlinde\t kiracı,\t sözleşmeyi\tfeshedebilir. Kiraya veren, kiralanandaki ayıbı gidermek yerine, uygun bir süre içinde ayıpsız benzeriyle değiştirebilir. Kiraya veren, kiracıya aynı malın ayıpsız bir benzerini hemen vererek ve uğradığı zararın tamamını gidererek, onun seçimlik haklarını kullanmasını önleyebilir.']","6098 Sayılı Türk Borçlar Kanunu Madde 314 uyarınca, kiracı, aksine sözleşme ve yerel âdet olmadıkça, kira bedelini ve gerekiyorsa yan giderleri, her ayın sonunda ve en geç kira süresinin bitiminde ödemekle yükümlüdür. Bu durumda, kirayı en geç kira süresinin bitiminde ödemeniz gerekmektedir.","6098 Sayılı Türk Borçlar Kanunu Madde 314 uyarınca, aksine bir sözleşme veya yerel âdet yoksa, kira bedeli her ayın sonunda ve en geç kira süresinin bitiminde ödenmelidir.",0.8333333333333334,0.7781394199098909,0.7225395103742358
Evde sonradan bir ayıp (kusur) çıkarsa kiracı olarak haklarım nelerdir?,"['3. Yapı malikinin sorumluluğu a. Giderim yükümlülüğü MADDE\t 69- Bir binanın veya diğer yapı eserlerinin maliki, bunların yapımındaki bozukluklardan veya bakımındaki eksikliklerden doğan zararı gidermekle yükümlüdür. İntifa ve oturma hakkı sahipleri de, binanın bakımındaki eksikliklerden doğan zararlardan, malikle birlikte müteselsilen sorumludurlar. Sorumluların, bu sebeplerle kendilerine karşı sorumlu olan diğer kişilere rücu hakkı saklıdır.   b. Zarar tehlikesini önleme MADDE\t 70- Bir başkasına ait bina veya\t diğer\t yapı\t eserlerinden\t zarar\t görme\ttehlikesiyle\tkarşılaşan\tkişi, bu tehlikenin giderilmesi için gerekli önlemlerin alınmasını hak sahiplerinden isteyebilir. Kişilerin\tve\tmalların\tkorunması\thakkındaki\tkamu\thukuku\tkuralları\tsaklıdır.  2. Kiralananın sonradan ayıplı hâle gelmesinden sorumluluk a. Genel olarak MADDE\t 305-\tKiralanan sonradan ayıplı duruma gelirse kiracı, kiraya verenden ayıpların giderilmesini veya kira bedelinden ayıpla orantılı bir indirim yapılmasını ya da zararının giderilmesini isteyebilir. Ancak, zararın giderilmesi istemi diğer seçimlik hakların kullanılmasını önlemez. Önemli ayıp durumunda kiracının sözleşmeyi fesih hakkı saklıdır.   b. Ayıbın giderilmesini isteme ve fesih MADDE\t 306-\tKiracı, kiraya verenden kiralanandaki ayıbın uygun bir sürede giderilmesini isteyebilir; bu sürede ayıp giderilmezse kiracı, ayıbı kiraya veren hesabına gidertebilir ve bundan doğan alacağını kira bedelinden indirebilir veya kiralananın ayıpsız bir benzeri ile değiştirilmesini isteyebilir. Ayıbın,\t kiralananın\t öngörülen\t kullanıma\t elverişliliğini\t ortadan\t kaldırması\t ya\t da\tönemli\t ölçüde\t engellemesi\t ve\t verilen\t sürede\t giderilmemesi\t hâlinde\t kiracı,\t sözleşmeyi\tfeshedebilir. Kiraya veren, kiralanandaki ayıbı gidermek yerine, uygun bir süre içinde ayıpsız benzeriyle değiştirebilir. Kiraya veren, kiracıya aynı malın ayıpsız bir benzerini hemen vererek ve uğradığı zararın tamamını gidererek, onun seçimlik haklarını kullanmasını önleyebilir.', 'ya\t da\tönemli\t ölçüde\t engellemesi\t ve\t verilen\t sürede\t giderilmemesi\t hâlinde\t kiracı,\t sözleşmeyi\tfeshedebilir. Kiraya veren, kiralanandaki ayıbı gidermek yerine, uygun bir süre içinde ayıpsız benzeriyle değiştirebilir. Kiraya veren, kiracıya aynı malın ayıpsız bir benzerini hemen vererek ve uğradığı zararın tamamını gidererek, onun seçimlik haklarını kullanmasını önleyebilir.', 'D. Kiracının borçları I. Kira bedelini ödeme borcu 1. Genel olarak MADDE\t313-\tKiracı, kira bedelini ödemekle yükümlüdür. \t 2. İfa zamanı MADDE\t 314-\tKiracı, aksine sözleşme ve yerel âdet olmadıkça, kira bedelini ve gerekiyorsa yan giderleri, her ayın sonunda ve en geç kira süresinin bitiminde ödemekle yükümlüdür.   3. Kiracının temerrüdü MADDE\t 315-\tKiracı, kiralananın tesliminden sonra muaccel olan kira bedelini veya yan gideri ödeme borcunu ifa etmezse, kiraya veren kiracıya yazılı olarak bir süre verip, bu sürede de ifa etmeme durumunda, sözleşmeyi feshedeceğini bildirebilir. Kiracıya verilecek süre en az on gün, konut ve çatılı işyeri kiralarında ise en az otuz gündür. Bu süre, kiracıya yazılı bildirimin yapıldığı tarihi izleyen günden itibaren işlemeye başlar.   II. Özenle kullanma ve komşulara saygı gösterme borcu MADDE\t 316-\tKiracı, kiralananı, sözleşmeye uygun olarak özenle kullanmak ve kiralananın bulunduğu taşınmazda oturan kişiler ile komşulara gerekli saygıyı göstermekle yükümlüdür. Kiracının bu yükümlülüğüne aykırı davranması durumunda kiraya veren, konut ve çatılı işyeri kirasında, en az otuz gün süre vererek, aykırılığın giderilmesi, aksi takdirde sözleşmeyi feshedeceği konusunda yazılı bir ihtarda bulunur. Diğer kira ilişkilerinde ise, kiraya veren, kiracıya önceden bir ihtarda bulunmaksızın, yazılı bir bildirimle sözleşmeyi hemen feshedebilir. Konut\tve\tçatılı\tişyeri\tkirasında,\tkiracının\tkiralanana\tkasten\tağır\tbir\tzarar\tvermesi,\tkiracıya\tverilecek\tsürenin\tyararsız\tolacağının\tanlaşılması\tveya\tkiracının\tbu\tyükümlülüğe\taykırı\t davranışının\t kiraya\t veren\t veya\t aynı\t taşınmazda\t oturan\t kişiler\t ile\t komşular\tbakımından\tçekilmez\tolması\tdurumlarında\tkiraya\tveren,\tyazılı\tbir\tbildirimle\tsözleşmeyi\themen\tfeshedebilir. \t III. Temizlik ve bakım giderlerini ödeme borcu MADDE\t 317- Kiracı, kiralananın olağan kullanımı için gerekli temizlik ve bakım giderlerini ödemekle yükümlüdür. Bu konuda yerel âdete de bakılır.']","6098 Sayılı Türk Borçlar Kanunu Madde 305 uyarınca, kiralanan sonradan ayıplı duruma gelirse kiracı, kiraya verenden ayıpların giderilmesini veya kira bedelinden ayıpla orantılı bir indirim yapılmasını ya da zararının giderilmesini isteyebilir. Kiracı, kiraya verenden kiralanandaki ayıbın uygun bir sürede giderilmesini talep edebilir; bu sürede ayıp giderilmezse kiracı, ayıbı kiraya veren hesabına gidertebilir ve bu masrafları kira bedelinden indirebilir. Ayrıca, ayıbın kiralananın öngörülen kullanıma elverişliliğini ortadan kaldırması durumunda kiracı, sözleşmeyi feshetme hakkına sahiptir.","6098 Sayılı Türk Borçlar Kanunu Madde 305 uyarınca, kiralanan sonradan ayıplı hale gelirse kiracı; ayıbın giderilmesini, kira bedelinden indirim yapılmasını veya zararının giderilmesini talep edebilir. Önemli ayıp halinde fesih hakkı saklıdır.",1.0,0.433353606689079,0.7307604638456824
Kiracı komşulara saygısızlık yaparsa ev sahibi ne yapabilir?,"['D. Kiracının borçları I. Kira bedelini ödeme borcu 1. Genel olarak MADDE\t313-\tKiracı, kira bedelini ödemekle yükümlüdür. \t 2. İfa zamanı MADDE\t 314-\tKiracı, aksine sözleşme ve yerel âdet olmadıkça, kira bedelini ve gerekiyorsa yan giderleri, her ayın sonunda ve en geç kira süresinin bitiminde ödemekle yükümlüdür.   3. Kiracının temerrüdü MADDE\t 315-\tKiracı, kiralananın tesliminden sonra muaccel olan kira bedelini veya yan gideri ödeme borcunu ifa etmezse, kiraya veren kiracıya yazılı olarak bir süre verip, bu sürede de ifa etmeme durumunda, sözleşmeyi feshedeceğini bildirebilir. Kiracıya verilecek süre en az on gün, konut ve çatılı işyeri kiralarında ise en az otuz gündür. Bu süre, kiracıya yazılı bildirimin yapıldığı tarihi izleyen günden itibaren işlemeye başlar.   II. Özenle kullanma ve komşulara saygı gösterme borcu MADDE\t 316-\tKiracı, kiralananı, sözleşmeye uygun olarak özenle kullanmak ve kiralananın bulunduğu taşınmazda oturan kişiler ile komşulara gerekli saygıyı göstermekle yükümlüdür. Kiracının bu yükümlülüğüne aykırı davranması durumunda kiraya veren, konut ve çatılı işyeri kirasında, en az otuz gün süre vererek, aykırılığın giderilmesi, aksi takdirde sözleşmeyi feshedeceği konusunda yazılı bir ihtarda bulunur. Diğer kira ilişkilerinde ise, kiraya veren, kiracıya önceden bir ihtarda bulunmaksızın, yazılı bir bildirimle sözleşmeyi hemen feshedebilir. Konut\tve\tçatılı\tişyeri\tkirasında,\tkiracının\tkiralanana\tkasten\tağır\tbir\tzarar\tvermesi,\tkiracıya\tverilecek\tsürenin\tyararsız\tolacağının\tanlaşılması\tveya\tkiracının\tbu\tyükümlülüğe\taykırı\t davranışının\t kiraya\t veren\t veya\t aynı\t taşınmazda\t oturan\t kişiler\t ile\t komşular\tbakımından\tçekilmez\tolması\tdurumlarında\tkiraya\tveren,\tyazılı\tbir\tbildirimle\tsözleşmeyi\themen\tfeshedebilir. \t III. Temizlik ve bakım giderlerini ödeme borcu MADDE\t 317- Kiracı, kiralananın olağan kullanımı için gerekli temizlik ve bakım giderlerini ödemekle yükümlüdür. Bu konuda yerel âdete de bakılır.', '3. Yapı malikinin sorumluluğu a. Giderim yükümlülüğü MADDE\t 69- Bir binanın veya diğer yapı eserlerinin maliki, bunların yapımındaki bozukluklardan veya bakımındaki eksikliklerden doğan zararı gidermekle yükümlüdür. İntifa ve oturma hakkı sahipleri de, binanın bakımındaki eksikliklerden doğan zararlardan, malikle birlikte müteselsilen sorumludurlar. Sorumluların, bu sebeplerle kendilerine karşı sorumlu olan diğer kişilere rücu hakkı saklıdır.   b. Zarar tehlikesini önleme MADDE\t 70- Bir başkasına ait bina veya\t diğer\t yapı\t eserlerinden\t zarar\t görme\ttehlikesiyle\tkarşılaşan\tkişi, bu tehlikenin giderilmesi için gerekli önlemlerin alınmasını hak sahiplerinden isteyebilir. Kişilerin\tve\tmalların\tkorunması\thakkındaki\tkamu\thukuku\tkuralları\tsaklıdır.  2. Kiralananın sonradan ayıplı hâle gelmesinden sorumluluk a. Genel olarak MADDE\t 305-\tKiralanan sonradan ayıplı duruma gelirse kiracı, kiraya verenden ayıpların giderilmesini veya kira bedelinden ayıpla orantılı bir indirim yapılmasını ya da zararının giderilmesini isteyebilir. Ancak, zararın giderilmesi istemi diğer seçimlik hakların kullanılmasını önlemez. Önemli ayıp durumunda kiracının sözleşmeyi fesih hakkı saklıdır.   b. Ayıbın giderilmesini isteme ve fesih MADDE\t 306-\tKiracı, kiraya verenden kiralanandaki ayıbın uygun bir sürede giderilmesini isteyebilir; bu sürede ayıp giderilmezse kiracı, ayıbı kiraya veren hesabına gidertebilir ve bundan doğan alacağını kira bedelinden indirebilir veya kiralananın ayıpsız bir benzeri ile değiştirilmesini isteyebilir. Ayıbın,\t kiralananın\t öngörülen\t kullanıma\t elverişliliğini\t ortadan\t kaldırması\t ya\t da\tönemli\t ölçüde\t engellemesi\t ve\t verilen\t sürede\t giderilmemesi\t hâlinde\t kiracı,\t sözleşmeyi\tfeshedebilir. Kiraya veren, kiralanandaki ayıbı gidermek yerine, uygun bir süre içinde ayıpsız benzeriyle değiştirebilir. Kiraya veren, kiracıya aynı malın ayıpsız bir benzerini hemen vererek ve uğradığı zararın tamamını gidererek, onun seçimlik haklarını kullanmasını önleyebilir.', 'ya\t da\tönemli\t ölçüde\t engellemesi\t ve\t verilen\t sürede\t giderilmemesi\t hâlinde\t kiracı,\t sözleşmeyi\tfeshedebilir. Kiraya veren, kiralanandaki ayıbı gidermek yerine, uygun bir süre içinde ayıpsız benzeriyle değiştirebilir. Kiraya veren, kiracıya aynı malın ayıpsız bir benzerini hemen vererek ve uğradığı zararın tamamını gidererek, onun seçimlik haklarını kullanmasını önleyebilir.']","6098 Sayılı Türk Borçlar Kanunu Madde 316 uyarınca, kiracı, kiralananı özenle kullanmak ve komşulara saygı göstermekle yükümlüdür. Kiracının bu yükümlülüğüne aykırı davranması durumunda, ev sahibi, konut ve çatılı işyeri kirasında, kiracıya en az otuz gün süre vererek aykırılığın giderilmesini talep edebilir; aksi takdirde sözleşmeyi feshedeceğini yazılı olarak bildirebilir. Diğer kira ilişkilerinde ise, ev sahibi, kiracıya önceden bir ihtarda bulunmaksızın, yazılı bir bildirimle sözleşmeyi hemen feshedebilir.","6098 Sayılı Türk Borçlar Kanunu Madde 316 uyarınca, kiracı komşulara gerekli saygıyı göstermekle yükümlüdür. Aykırılık durumunda ev sahibi, en az 30 gün süre vererek yazılı ihtar gönderir; durum düzelmezse sözleşmeyi feshedebilir.",1.0,0.3339700176997079,0.5937184118046022
Apartman asansörünün bakımını ne sıklıkla yaptırmalıyız?,"['binaya/yapıya ait yönetim bürosunda kalıcı olarak muhafaza eder. \n(4) Asansör monte eden veya onun yetkili servisi, insan can ve mal güvenliği yönünden \nasansörün risk taşıması durumunda bina sorumlusunu yazılı olarak bilgilendirir. Bina sorumlusu \nasansör monte eden veya onun yetkili servisi vasıtasıyla asansörün güv enli hale getirilmesini \nsağlamakla yükümlüdür. \n(5) Asansör monte eden veya onun yetkili servisi, asansörde yapılan aksam ve parça \ndeğişiklikleri ile bildirilen kazaları asansör kayıt defterine işler. \n(6) Bakım sözleşmesi yapıldıktan sonra asansör monte ede n veya onun yetkili servisi, \nbinadaki/yapıdaki asansör sayısı dikkate alınarak bina sorumlusunun belirleyeceği sayıda kişiye acil \ndurumlarda kurtarma çalışması konusunda yılda en az bir defa eğitim verir. Eğitim, yetkili servis \nteknik bakım ve onarım perso neli tarafından verilir. Verilen bu eğitim yetkili servis teknik sorumlusu \nve eğitimi veren kişi tarafından imzalanan bir tutanakla kayıt altına alınır ve tutanağın bir sureti bina \nsorumlusuna iletilir. Bina sorumlusu, eğitim alan kişi/kişilerin değişmesi halinde yeni kişi/kişilere \neğitim verilmesini sağlar. Kurtarma talimatının, kurtarma çalışmasını yapacak kişi/kişilerin kolaylıkla \ngörebilecekleri yerlerde muhafaza edilmesi ve amacına uygun hazırlanmış olması gerekir. \n(7) Asansör monte eden, piyasaya arz ettiği her tip ve özellikteki asansör için yedek aksam ve \nparçayı en az üç yıl süreyle temin etmekle yükümlüdür. \n(8) Asansör monte eden, kendisi tarafından piyasaya arz edilen asansöre bakım, onarım ve \nservis hizmeti veren bir başka asansör monte edenin ve ya onun yetkili servisinin veya bina \nsorumlusunun, yedek aksam veya parça ile asansörde bakım yapmayı mümkün kılacak her türlü cihaz \nve donanım talebini normal piyasa koşullarında sağlamak zorundadır. \n(9) Bakım, onarım, arıza giderme ve periyodik kontrol f aaliyetleri yürütülürken gerekli iş sağlığı', 'servis hizmeti veren bir başka asansör monte edenin ve ya onun yetkili servisinin veya bina \nsorumlusunun, yedek aksam veya parça ile asansörde bakım yapmayı mümkün kılacak her türlü cihaz \nve donanım talebini normal piyasa koşullarında sağlamak zorundadır. \n(9) Bakım, onarım, arıza giderme ve periyodik kontrol f aaliyetleri yürütülürken gerekli iş sağlığı \nve güvenliği tedbirleri 20/6/2012 tarihli ve 6331 sayılı İş Sağlığı ve Güvenliği Kanunu ve ilgili mevzuat \nhükümleri doğrultusunda bina sorumlusu ile bakım sözleşmesi imzalayan asansör monte eden veya \nonun yetkili servisince alınır. \n(10) Bakım esnasında, bakım ve onarım işlerinden kaynaklı nedenlerle gerek teknik bakım ve \nonarım personelinin gerekse bakımla ilgisi bulunmayan kişi/kişilerin yaralanmasına veya ölümüne \nneden olabilecek ihmallere dair sorumluluk, bina sorumlusunun bakım sözleşmesi imzaladığı asansör \nmonte eden veya onun yetkili servisindedir. \n(11) Periyodik kontrol neticesinde güvensiz olarak tanımlanan ve kırmızı renkli bilgi etiketi \niliştirilen asansöre; kusurlu, hafif kusurlu veya kusursuz hale getir ilinceye kadar bakım hizmeti \nsunulamaz. Güvensiz olma durumundan, kusurlu duruma geçen ve periyodik kontrol tarihi başlangıç \nkabul edilerek yüz yirmi gün içerisinde hafif kusurlu veya kusursuz hale getirilmeyen asansöre de söz \nkonusu sürenin sona erdiği za man itibarıyla bakım hizmeti sunulamaz. Asansör monte eden veya \nonun yetkili servisi bu süre zarfında bina sorumlusundan aylık bakım ücreti talebinde bulunamaz. \n(12) Asansör monte eden veya onun yetkili servisi; bakım, onarım, arıza giderme ve periyodik \nkontrol faaliyetleri yürütülürken görevlendireceği teknik bakım ve onarım personeline ilişkin \ntanımlayıcı tüm bilgilerin bakım sözleşmesinde yer almasını sağlar. Teknik bakım ve onarım \npersoneline ilişkin değişiklik olması halinde, bu değişikliğe dair bilginin de söz konusu bakım \nsözleşmesinde yer alması ilgili asansör monte eden veya onun yetkili servisince sağlanır.', 'Biten kayıt defteri, bina sorumlusu tarafından asa nsörün kullanım ömrü boyunca muhafaza edilir. \nKayıt defteri ile ilgili tüm gereklilikler halen kullanımda olan bütün asansörler için de geçerlidir. \n(4) Asansör bakım, onarım ve servis hizmeti sonrasında oluşan atığın bertaraf edilmesi \n9/8/1983 tarihli ve 2872 sayılı Çevre Kanununa uygun olarak yapılır. \n(5) Asansör Yönetmeliği (2014/33/AB) kapsamında piyasaya arz edilen veya kullanımda olan \nasansör/asansörler için yapılacak olan bakım sözleşmesinde/sözleşmelerinde, o asansöre/asansörlere \nyönelik herhangi bir  cihaz veya şifreleme gibi yöntemlerle engelleme veya kısıtlama yapılıp \nyapılmadığına dair bilginin yer alması asansör monte eden veya onun yetkili servisi tarafından \nsağlanır. \nBakımın kapsamı \nMADDE 9 – (1) Asansörün, asansörü oluşturan tüm aksam ve parçal arın bakımı asansör monte \neden tarafından hazırlanmış olan bakım kılavuzunda yer alan talimatlara ve                                  güncel \nTS EN 13015: Asansör ve Yürüyen Merdivenlerin Bakımı, Bakım Talimatları İçin Kurallar standardında \nbelirtilen gerekliliklere göre yapılır. \n(2) Bu Yönetmeliğe göre bakım; \na) Yağlama ve temizlemeyi, \nb) Kontrolleri, \nc) Kurtarma çalışmalarını, \nç) Ayarlama işlemlerini, \nd) Kullanıma veya yıpranmaya bağlı olarak meydana gelebilen bileşen onarımını veya \ndeğişimini, \nkapsar. \n(3) Bu Yönetmeliğe göre bakım; \na) Asansörün yerinin değiştirilmesini, \nb) Tahrik ünitesi, askı sistemi, taşıyıcı/kabin, durak kapısı ve/veya asansör güvenlik \naksamlarının değişimini, \nc) Asansör kumanda sisteminde yapılan değişiklikleri, \nç) İtfaiye tarafından yapılan kurtarma çalışmalarını, \nd) Asansör kuyusunun dış bölümlerinin temizlenmesini, \ne) Taşıyıcı/kabin iç kısmının temizlenmesini, \nkapsamaz. \n(4) 15/8/2004 tarihinden önce monte edilen ve ilgili mevzuata göre ilgili idare tarafından kayıt \naltına alınan a sansörün beyan yükünde ve/veya beyan hızında ve/veya seyir mesafesinde değişiklik', 'onaylı tescil belgesi ilgili idare tarafından düzenlenir ve asansör monte edene sunulur. \n(7) İlgili idare, tescil başvurusun da ikinci fıkrada istenen belgelerin dışında asansör monte \nedenden herhangi bir belge talebinde bulunamaz. \nÜÇÜNCÜ BÖLÜM \nBakım, Bakımın Kapsamı ve Bakımla İlgili Diğer Hususlar \nBakım \nMADDE 8 – (1) Bu Yönetmelik kapsamında yer alan asansörün bakımı, bina sor umlusunun \nbakım sözleşmesi imzaladığı asansör monte eden veya onun yetkili servisi tarafından yapılır. Yapı \nkullanma izin belgesi alan ve amacına uygun olacak şekilde ilk kez kullanıma açılan binada/yapıda \nyasal olarak bina sorumlusu atanana kadar asansör yaptırıcısı ile asansör monte eden veya onun \nyetkili servisi arasında bakım sözleşmesi yapılır.  \n(2) Bakım sözleşmesinin birden fazla asansörü kapsaması durumunda, bakım hizmeti sunulacak \nher bir asansöre ait asansör kimlik numarası ve asansörün açık adresi bu sözleşmede belirtilir. \n(3) Piyasaya arz edilen asansörün beyan yükü, beyan hızı, tahrik türü, motor seri numarası ve \ngücü, halat ve/veya zincirler ile tip kontrol belgesi gerektiren aksam ve parçaların teknik özellikleri, \ntesis planları ve elektrik de vre şemaları ile asansör periyodik kontrol sonuçları ve kazaların kayıt \nedileceği asansör kayıt defteri, söz konusu asansörü piyasaya arz eden asansör monte eden \ntarafından sağlanır. Ayrıca asansörün kimlik numarası, piyasaya arz tarihi ve tescil tarihi as ansör kayıt \ndefterinde belirtilir. Asansör kayıt defterinin bitmesi durumunda, yeni defter bina sorumlusuyla \nbakım sözleşmesi imzalayan asansör monte eden veya onun yetkili servisi tarafından temin edilir. \nBiten kayıt defteri, bina sorumlusu tarafından asa nsörün kullanım ömrü boyunca muhafaza edilir. \nKayıt defteri ile ilgili tüm gereklilikler halen kullanımda olan bütün asansörler için de geçerlidir. \n(4) Asansör bakım, onarım ve servis hizmeti sonrasında oluşan atığın bertaraf edilmesi \n9/8/1983 tarihli ve 2872 sayılı Çevre Kanununa uygun olarak yapılır.', 'h) Hizmet denetimi: Asansör monte edene veya onun yetkili servisine veya bina sorumlusuna \nyönelik Bakanlık tarafından yapılan denetimi, \nı) İlgili idare: Be lediyeleri veya belediye sınırları dışında kalan alanlardaki yapılar için il özel \nidarelerini, \ni) İktisadi işletmeci: Asansör monte edeni, asansör güvenlik aksamı imalatçısını, yetkili \ntemsilciyi, ithalatçıyı veya dağıtıcıyı, \nj) Kurtarma çalışması: Asansör  içerisinde insanın veya insanların mahsur kaldığına dair bilginin \nalınmasıyla birlikte kurtarma talimatına uygun olarak yapılan ve insanın veya insanların serbest \nkalmasıyla sonuçlanan çalışmayı, \nk) Mevcut asansör: 15/8/2004 tarihinden önce monte edilen v e halen kullanılmakta olan \nasansörü, \nl) Mesleki yeterlilik belgesi: Mesleki Yeterlilik Kurumu tarafından onaylanmış olan ve bireyin \nbilgi, beceri ve yetkinliğini ifade eden belgeyi, \nm) Muayene kuruluşu: Türkiye’de yerleşik özel veya kamu kuruluşlarından, TS EN ISO/IEC \n17020 standardına göre Türk Akreditasyon Kurumunca 4/5/2018 tarihli ve 30411 sayılı Resmî \nGazete’de yayımlanan Asansör Periyodik Kontrol Yönetmeliği kapsamında A tipi muayene kuruluşu \nolarak akredite edilen kuruluşu, \nn) Periyodik kontrol: Asansörün güvenli kullanımı ve işletme yönünden uygun çalışıp \nçalışmadığına dair yaptırılacak olan muayeneyi, \no) Piyasaya arz: Asansörün ticari veya kamu faaliyetleri kapsamında ücretli veya ücretsiz olarak \nkullanımının sağlanmasını, \nö) Ruhsat makamı: Belediyeleri veya belediye sınırları dışında kalan alanlardaki binalar/yapılar \niçin valilikleri veya ilgili mevzuat çerçevesinde yapı ruhsatı ve yapı kullanma izin belgesi verme \nyetkisine sahip kurum ve kuruluşları, \np) Ser vis teknik sorumlusu: Yetkili servis faaliyetlerini idari ve teknik olarak yöneten, gerekli \ndokümanları hazırlayan/hazırlatan ve yetkili servis adına yasal olarak temsil ve ilzama yetkili olan \nkişiyi,  \nr) Teknik bakım personeli: Yetkili servis bünyesinde a sansörlerde bakım, onarım ve servis işini', 'ç) İtfaiye tarafından yapılan kurtarma çalışmalarını, \nd) Asansör kuyusunun dış bölümlerinin temizlenmesini, \ne) Taşıyıcı/kabin iç kısmının temizlenmesini, \nkapsamaz. \n(4) 15/8/2004 tarihinden önce monte edilen ve ilgili mevzuata göre ilgili idare tarafından kayıt \naltına alınan a sansörün beyan yükünde ve/veya beyan hızında ve/veya seyir mesafesinde değişiklik \nyapılması halinde, bu asansörde, güncel TS EN 81-80 standardı gereklilikleri esas alınır. \n(5)  15/8/2004 ile 1/9/2017 tarihleri arasında piyasaya arz edilen ve ilgili mevzuat a göre ilgili \nidare tarafından kayıt altına alınan asansörün beyan yükünde ve/veya beyan hızında ve/veya seyir \nmesafesinde değişiklik yapılması halinde, bu asansörde, ilk defa piyasaya arz edildiği tarihte \nyürürlükte bulunan uyumlaştırılmış standart gereklilikleri esas alınır. \n(6) Üçüncü fıkranın (a), (b) ve (c) bentlerinde, dördüncü ve beşinci fıkralarında yer alan ve \nbakım çalışması olarak değerlendirilmeyen asansöre ait değişiklikler, asansör monte eden tarafından \nyerine getirilir. Bu değişikliklerin ilg ili mevzuatına ve/veya standardına uygun yapılıp yapılmadığına \ndair sorumluluk, söz konusu değişiklikleri yapan asansör monte edendedir. Bu değişiklikleri yapmak \nüzere asansör monte eden adına hareket eden montaj elemanının ve/veya teknik bakım ve onarım \npersonelinin, bu Yönetmelikte ve/veya ilgili mevzuatta belirtilen yeterlilik belgesine sahip olması \ngerekir. \n(7) Dördüncü ve beşinci fıkrada belirtilen durumlarda asansör monte eden tarafından asansör \nuygulama projesi hazırlanır/hazırlatılır ve ruhsat makam ının onayına sunulur. Ruhsat makamı \ntarafından onaylanan asansör uygulama projesine uygun olacak şekilde beyan yükünde ve/veya \nbeyan hızında ve/veya seyir mesafesinde değişiklik yapılan asansörün tescili için asansör monte eden \ntarafından yeşil renkli bilg i etiketine esas periyodik kontrol raporuyla birlikte altmış gün içerisinde']","Asansör Yönetmeliği Madde 8 uyarınca, asansörün bakımı, bina sorumlusunun bakım sözleşmesi imzaladığı asansör monte eden veya onun yetkili servisi tarafından yapılır. Bakım sıklığına dair spesifik bir süre belirtilmemekle birlikte, asansörlerin güvenli bir şekilde çalışabilmesi için periyodik kontrollerin düzenli olarak yapılması gerekmektedir. Bu kontroller, asansörün güvenli kullanımı ve işletme yönünden uygun çalışıp çalışmadığını belirlemek amacıyla gerçekleştirilir. Dolayısıyla, asansör bakımının ne sıklıkla yapılacağı, bakım sözleşmesinde belirtilen şartlara ve asansörün kullanım durumuna bağlı olarak değişiklik gösterebilir.","Asansör İşletme ve Bakım Yönetmeliği Madde 8 uyarınca, asansörün bakımı yetkili servis tarafından periyodik olarak ayda en az bir defa yapılmalıdır.",0.8,0.0,0.42236939799222994
"Asansör denetiminde kırmızı etiket aldı, kullanmaya devam edebilir miyiz?","['ç) İtfaiye tarafından yapılan kurtarma çalışmalarını, \nd) Asansör kuyusunun dış bölümlerinin temizlenmesini, \ne) Taşıyıcı/kabin iç kısmının temizlenmesini, \nkapsamaz. \n(4) 15/8/2004 tarihinden önce monte edilen ve ilgili mevzuata göre ilgili idare tarafından kayıt \naltına alınan a sansörün beyan yükünde ve/veya beyan hızında ve/veya seyir mesafesinde değişiklik \nyapılması halinde, bu asansörde, güncel TS EN 81-80 standardı gereklilikleri esas alınır. \n(5)  15/8/2004 ile 1/9/2017 tarihleri arasında piyasaya arz edilen ve ilgili mevzuat a göre ilgili \nidare tarafından kayıt altına alınan asansörün beyan yükünde ve/veya beyan hızında ve/veya seyir \nmesafesinde değişiklik yapılması halinde, bu asansörde, ilk defa piyasaya arz edildiği tarihte \nyürürlükte bulunan uyumlaştırılmış standart gereklilikleri esas alınır. \n(6) Üçüncü fıkranın (a), (b) ve (c) bentlerinde, dördüncü ve beşinci fıkralarında yer alan ve \nbakım çalışması olarak değerlendirilmeyen asansöre ait değişiklikler, asansör monte eden tarafından \nyerine getirilir. Bu değişikliklerin ilg ili mevzuatına ve/veya standardına uygun yapılıp yapılmadığına \ndair sorumluluk, söz konusu değişiklikleri yapan asansör monte edendedir. Bu değişiklikleri yapmak \nüzere asansör monte eden adına hareket eden montaj elemanının ve/veya teknik bakım ve onarım \npersonelinin, bu Yönetmelikte ve/veya ilgili mevzuatta belirtilen yeterlilik belgesine sahip olması \ngerekir. \n(7) Dördüncü ve beşinci fıkrada belirtilen durumlarda asansör monte eden tarafından asansör \nuygulama projesi hazırlanır/hazırlatılır ve ruhsat makam ının onayına sunulur. Ruhsat makamı \ntarafından onaylanan asansör uygulama projesine uygun olacak şekilde beyan yükünde ve/veya \nbeyan hızında ve/veya seyir mesafesinde değişiklik yapılan asansörün tescili için asansör monte eden \ntarafından yeşil renkli bilg i etiketine esas periyodik kontrol raporuyla birlikte altmış gün içerisinde', '6 ncı maddesinin birinci fıkrasında öngörülen idari para cezası uygulanır. \n(6) İdari para cezası, ceza kararının ilgiliye tebliğinden itibaren bir ay içerisinde ödenir. \n(7) (Ek:RG-10/2/2023-32100) Bu Yönetmelik hükümlerine aykırı davrananlar hakkında 7223 \nsayılı Kanun kapsamında uygulanacak idari para cezası kararları; \na) Denetimin Bakanlık merkez birimi personeli tarafından yapılması halinde sorumluluk alanı \nçerçevesinde bakan yardımcısı tarafından, \nb) Denetimin sadece il müdürlüğü personeli tarafından veya Bakanlık merkez birimi personeli \nile il müdürlüğü personelinin birlikte katılımıyla yapılması halinde asansörün monte edildiği yerdeki il \nmüdürü tarafından, \nverilir. \nAtıflar \nMADDE 18 – (1) 24/6/2015 tarihli ve   29396 sayılı Resmî Gazete’de yayımlanan Asansör \nİşletme, Bakım ve Periyodik Kontro l Yönetmeliğine yapılan bütün atıflar, bu Yönetmeliğe yapılmış \nsayılır. \nYürürlükten kaldırılan yönetmelik \nMADDE 19 – (1) 24/6/2015 tarihli ve 29396 sayılı Resmî Gazete’de yayımlanan Asansör \nİşletme, Bakım ve Periyodik Kontrol Yönetmeliği yürürlükten kaldırılmıştır. \nKayıt altına alınmamış asansörün tescili \nGEÇİCİ MADDE 1 – (1) Bu Yönetmeliğe göre TS EN 81 -80 standardı esas alınarak güvenlik \nseviyesi artırılan mevcut asansör veya 15/8/2004 -24/6/2015 tarihleri arasında piyasaya arz \nedilmesine rağmen kayıt altı na alınmamış olan asansör, bir defaya mahsus olmak üzere ilgili idare \ntarafından tescil edilir. Bina sorumlusu: \na) Mevcut asansörün güvenlik seviyesinin TS EN 81 -80 standardına göre artırıldığını \nispatlayacak olan yeşil veya mavi renkli bilgi etiketine esa s periyodik kontrol raporuyla, bir sonraki \nperiyodik kontrol tarihine kadar ilgili idareye başvurur. \nb) 15/8/2004 -24/6/2015 tarihleri arasında piyasaya arz edilmesine rağmen kayıt altına \nalınmamış olan asansöre ait yeşil veya mavi renkli bilgi etiketine es as periyodik kontrol raporuyla, bir \nsonraki periyodik kontrol tarihine kadar ilgili idareye başvurur.', 'uygulama projesi hazırlanır/hazırlatılır ve ruhsat makam ının onayına sunulur. Ruhsat makamı \ntarafından onaylanan asansör uygulama projesine uygun olacak şekilde beyan yükünde ve/veya \nbeyan hızında ve/veya seyir mesafesinde değişiklik yapılan asansörün tescili için asansör monte eden \ntarafından yeşil renkli bilg i etiketine esas periyodik kontrol raporuyla birlikte altmış gün içerisinde \nilgili idareye başvurulur. Asansörün tescil belgesi, Ek -2’de yer alan içeriğe uygun olacak şekilde ilgili \nidare tarafından düzenlenir ve asansör monte edene sunulur. \nBakımla ilgili diğer hususlar \nMADDE 10 – (1) Bina sorumlusu ile sözleşme imzalayan asansör monte eden veya onun yetkili \nservisi, güvenli kullanım için söz konusu asansörü oluşturan aksam ve parçaları da içerecek şekilde bir \nbütün olarak gerekli koşulları sağlayıp sağlam adığına ilişkin durum tespit raporu hazırlar ve bina \nsorumlusuna iletir. Durum tespit raporu asansör monte edenin piyasaya arz ettiği ve bakım \nsözleşmesi yaptığı asansör için hazırlanmaz. \n(2) Asansör monte eden veya onun yetkili servisince her bakımda yapılan işlemler güncel TS EN \n13015: Asansör ve Yürüyen Merdivenlerin Bakımı, Bakım Talimatları İçin Kurallar standardındaki \ngereklilikleri de içerecek şekilde hazırlanmış olan bakım föyü ile kayıt altına alınır ve bir nüshası bina \nsorumlusuna teslim edilir, b ir nüshası da kendisi tarafından muhafaza edilir ve talep edilmesi \ndurumunda Bakanlığa ve diğer ilgililere sunulur. \n(3) Bina sorumlusu bakım föylerini asansörün makina veya makara dairesinde veya \nbinaya/yapıya ait yönetim bürosunda kalıcı olarak muhafaza eder. \n(4) Asansör monte eden veya onun yetkili servisi, insan can ve mal güvenliği yönünden \nasansörün risk taşıması durumunda bina sorumlusunu yazılı olarak bilgilendirir. Bina sorumlusu \nasansör monte eden veya onun yetkili servisi vasıtasıyla asansörün güv enli hale getirilmesini \nsağlamakla yükümlüdür.', 'yetkisine sahip kurum ve kuruluşları, \np) Ser vis teknik sorumlusu: Yetkili servis faaliyetlerini idari ve teknik olarak yöneten, gerekli \ndokümanları hazırlayan/hazırlatan ve yetkili servis adına yasal olarak temsil ve ilzama yetkili olan \nkişiyi,  \nr) Teknik bakım personeli: Yetkili servis bünyesinde a sansörlerde bakım, onarım ve servis işini \nyürütmek üzere görevlendirilen ve ilgili mevzuat kapsamında belgeli olan asansör bakım ve \nonarımcısını, \ns) Tescil: Asansörün resmî olarak ilgili idare tarafından kayıt altına alınmasını, \nş) TSE: Türk Standardları Enstitüsünü, \nt) TS EN 81 -80 standardı: Asansörler - Yapım ve Montaj için Güvenlik Kuralları: Yolcu ve Yük \nAsansörleri için Özel Uygulamalar - Bölüm 80: Mevcut Yolcu ve Yük Asansörlerinin Güvenliğini \nGeliştirme Kurallarını, \nu) Yetkili servis: Asansörlerde ba kım, onarım ve servis hizmetinin yürütülebilmesi için asansör \nmonte edenin kendi adına kurduğu servis istasyonu veya gerekli olduğu durumlarda sorumluluğu \nkendinde olmak üzere sözleşme ile yetki verdiği gerçek veya tüzel kişiyi, \nü) (Ek:RG-10/2/2023-32100) Bakan yardımcısı: Sanayi ve Teknoloji Bakanlığının ilgili bakan \nyardımcısını, \nv) (Ek:RG-10/2/2023-32100) İl müdürlüğü: Sanayi ve teknoloji il müdürlüğünü, \ny) (Ek:RG-10/2/2023-32100) İl müdürü: Sanayi ve teknoloji il müdürünü, \nifade eder. \nİKİNCİ BÖLÜM \nAsansör Kimlik Numarası, Asansörün Binaya/Yapıya Fenni \nUygunluğunun Kontrolü ve Asansörün Tescili \nAsansör kimlik numarası \nMADDE 5 – (1) Bu Yönetmelik kapsamında bulunan her asansör, bir asansör kimlik numarası ile \ntanımlanır. \n(2) Asansör kimlik numarası Asansör Periyodik Kontrol Yönetmeliğinde belirtilen usul ve \nesaslara uygun olarak muayene kuruluşu tarafından periyodik kontrol aşamasından önce oluşturulur. \nAsansör kimlik numarası Asansör Periyodik Kontrol Yönetmeliğinin 21 inci maddesinde tanımlanan \nformata uygun bir etiket üzerinde belirtilir. Bu etiket, periyodik kontrol aşamasında muayene', 'tanımlanır. \n(2) Asansör kimlik numarası Asansör Periyodik Kontrol Yönetmeliğinde belirtilen usul ve \nesaslara uygun olarak muayene kuruluşu tarafından periyodik kontrol aşamasından önce oluşturulur. \nAsansör kimlik numarası Asansör Periyodik Kontrol Yönetmeliğinin 21 inci maddesinde tanımlanan \nformata uygun bir etiket üzerinde belirtilir. Bu etiket, periyodik kontrol aşamasında muayene \nkuruluşu tarafından asansör kabinine iliştirilir.  \n(3) Asansör kabinine iliştirilen ve asansör kimlik numarasını içeren etiketin, asansörün kullanım \nömrü boyunca muh afaza edilmesine ve gerektiğinde yenilenmesine dair sorumluluk,   bina \nsorumlusundadır. \nAsansörün binaya/yapıya fenni uygunluğunun kontrolü \nMADDE 6 – (1) Asansör Yönetmeliği (2014/33/AB) kapsamında monte edilen asansörün monte \nedildiği binaya/yapıya fenni u ygunluğuna ilişkin kontroller 3/5/1985 tarihli ve 3194 sayılı İmar \nKanununa, ilgili mevzuata ve erişilebilirlik mevzuatına uygun olacak şekilde ilgili ruhsat makamı \ntarafından yürütülür. \n(2) Birinci fıkrada belirtilen kontrollerin ilgili mevzuatına uygun b ir şekilde yürütülmesine dair \nsorumluluk ilgili ruhsat makamındadır. \nAsansörün tescili \nMADDE 7 – (1) Asansör Yönetmeliği (2014/33/AB) kapsamında piyasaya arz edilen her asansör \nilgili idareye tescil ettirilir. Tescil başvurusu, asansörün piyasaya arz edild iği tarih itibarıyla altmış gün \niçerisinde söz konusu asansörü piyasaya arz eden asansör monte eden tarafından yapılır. \n(2) Asansör monte eden, tescil işlemi için aşağıda belirtilen belgelerin bir sureti ile birlikte ilgili \nidareye başvurur: \na) Sanayi sicil belgesi. \nb) Onaylanmış kuruluşça düzenlenen uygunluk belgesi veya raporu. \nc) AB uygunluk beyanı. \nç) Garanti belgesi. \nd) (Değişik:RG-3/4/2021-31443) AB uygunluk beyanı ve garanti belgesini imzalayan yetkilinin \nadı, soyadı ve unvanına dair bilgileri içerecek şekilde kendisi tarafından hazırlanan ve onaylanan yazılı \nbeyan belgesi. \ne) TSE Hizmet Yeterlilik Belgesi.', 'periyodik kontrol tarihine kadar ilgili idareye başvurur. \nb) 15/8/2004 -24/6/2015 tarihleri arasında piyasaya arz edilmesine rağmen kayıt altına \nalınmamış olan asansöre ait yeşil veya mavi renkli bilgi etiketine es as periyodik kontrol raporuyla, bir \nsonraki periyodik kontrol tarihine kadar ilgili idareye başvurur. \n(2) Asansörün tescil belgesi, Ek -5’te yer alan içeriğe uygun olacak şekilde ilgili idare tarafından \ndüzenlenir ve bina sorumlusuna sunulur. \nYürürlük \nMADDE 20 – (1) Bu Yönetmeliğin; \na) 13 üncü maddesinin on ikinci fıkrası yayımı tarihinden on iki ay sonra, \nb) Diğer hükümleri yayımı tarihinde, \nyürürlüğe girer. \nYürütme \nMADDE 21 – (1) Bu Yönetmelik hükümlerini Sanayi ve Teknoloji Bakanı yürütür. \n  \nEkleri için tıklayınız. \n  \n  Yönetmeliğin Yayımlandığı Resmî Gazete’nin \nTarihi Sayısı \n6/4/2019 30737 \nYönetmelikte Değişiklik Yapan Yönetmeliklerin Yayımlandığı Resmî \nGazetelerin \nTarihi Sayısı \n1.        3/4/2021 31443 \n2.         11/7/2021 31538  \n3. 10/2/2023 32100']","Asansör İşletme, Bakım ve Periyodik Kontrol Yönetmeliği Madde 10 uyarınca, kırmızı etiket alan bir asansör, insan can ve mal güvenliği yönünden risk taşıdığı için kullanıma kapatılmalıdır. Bu durumda, asansörün güvenli hale getirilmesi için bina sorumlusunun asansör monte eden veya yetkili servisi vasıtasıyla gerekli önlemleri alması gerekmektedir. Dolayısıyla, kırmızı etiket almış bir asansörün kullanılması güvenli değildir.","Asansör İşletme ve Bakım Yönetmeliği Madde 10 uyarınca, kırmızı etiketli (güvensiz) asansörün kullanılması yasaktır ve güvenli hale getirilene kadar bakım hizmeti sunulamaz.",0.3333333333333333,0.5925257719879571,0.7147942280365758
Binada kaç tane yangın söndürme tüpü bulundurmak zorundayız?,"['K.) (1) Taşınabilir söndürme cihazlarının tipi ve sayısı, mekânlarda var olan durum ve risklere göre belirlenir. Buna göre; a) A sınıfı yangın çıkması muhtemel yerlerde, öncelikle çok maksatlı kuru kimyevi tozlu veya sulu, b) B sınıfı yangın çıkması muhtemel yerlerde, öncelikle kuru kimyevi tozlu, karbondioksitli veya köpüklü, c) C sınıfı yangın çıkması muhtemel yerlerde, öncelikle kuru kimyevi tozlu veya karbondioksitli, ç) D sınıfı yangın çıkması muhtemel yerlerde, öncelikle kuru metal tozlu, söndürme cihazları bulundurulur. Hastanelerde, huzurevlerinde, anaokullarında ve benzeri yerlerde sulu veya temiz gazlı söndürme cihazlarının tercih edilmesi gerekir. (2) Düşük tehlike sınıfında her 500 m2, orta tehlike ve yüksek tehlike sınıfında her 250 m² yapı inşaat alanı için 1 adet olmak üzere, uygun tipte 6 kg’lık kuru kimyevî tozlu veya eşdeğeri gazlı yangın söndürme cihazları bulundurulması gerekir. (3) Otoparklarda, depolarda, tesisat dairelerinde ve benzeri yerlerde ayrıca tekerlekli tip söndürme cihazı bulundurulması mecburidir. (4) Söndürme cihazları dışarıya doğru, geçiş boşluklarının yakınına ve dengeli dağıtılarak, görülebilecek şekilde işaretlenir ve her durumda kolayca girilebilir yerlere, yangın dolaplarının içine veya yakınına yerleştirilir. Söndürme cihazlarına ulaşma mesafesi en fazla 25 m olur. Söndürme cihazlarının, kapı arkasında, yangın dolapları hariç kapalı dolaplarda ve derin duvar girintilerinde bulundurulmaması ve ısıtma cihazlarının üstüne veya yakınına konulmaması gerekir. Ancak, herhangi bir sebeple söndürme cihazlarının doğrudan görünmesini engelleyen yerlere konulması halinde, yerlerinin uygun fosforlu işaretler ile gösterilmesi şarttır.  (5) Taşınabilir söndürme cihazlarında söndürücünün duvara bağlantı asma halkası duvardan kolaylıkla alınabilecek şekilde yerleştirilir ve 4 kg’dan daha ağır ve 12 kg’dan hafif olan cihazların zeminden olan yüksekliği yaklaşık 90 cm’yi aşmayacak şekilde montaj yapılır. (6) Arabalı yangın söndürme', 'engelleyen yerlere konulması halinde, yerlerinin uygun fosforlu işaretler ile gösterilmesi şarttır.  (5) Taşınabilir söndürme cihazlarında söndürücünün duvara bağlantı asma halkası duvardan kolaylıkla alınabilecek şekilde yerleştirilir ve 4 kg’dan daha ağır ve 12 kg’dan hafif olan cihazların zeminden olan yüksekliği yaklaşık 90 cm’yi aşmayacak şekilde montaj yapılır. (6) Arabalı yangın söndürme cihazlarının TS EN 1866 ve diğer taşınabilir yangın söndürme cihazlarının TS 862- EN 3 kalite belgeli olması şarttır. (7) Yangın söndürme cihazlarının periyodik kontrolü ve bakımı TS ISO 11602-2 standardına göre yapılır. Söndürme cihazlarının bakımını yapan üreticinin veya servis firmalarının dolum ve servis yeterlilik belgesine sahip olması gerekir. Servis veren firmalar, istenildiğinde müşterilerine belgelerini göstermek zorundadır. Söndürme cihazlarının standartlarda belirtilen hususlar doğrultusunda yılda bir kez yerinde genel kontrolleri yapılır ve dördüncü yılın sonunda içindeki söndürme maddeleri yenilenerek hidrostatik testleri yapılır. Cihazlar dolum için alındığında, söndürme cihazlarının bulundukları yerleri tehlike altında bırakmamak için, servisi yapan firmalar, bakıma aldıkları yangın söndürme cihazlarının yerine, aldıkları söndürücü cihazın özelliğinde ve aynı sayıda kullanıma hazır yangın söndürme cihazlarını geçici olarak bırakmak zorundadır.', '(7) Giriş, çıkış ve şaftları üst katlardan 120 dakika yangına dayanıklı döşeme veya bölme ile ayrılan bodrum katlar, beşinci fıkrada belirtilen yapı yüksekliklerine dahil edilmez ve yangın güvenlik tedbirleri bakımından ayrı değerlendirilir. (8) Çatı arası piyeslerden binanın normal merdivenine veya korunumlu kaçış merdivenine alternatif kaçış imkânı sağlanması durumunda, çatı arası piyes yüksekliği beşinci fıkrada belirtilen yapı yüksekliklerine dahil edilmez.  Elektrik tesisatı ve sistemlerin özellikleri MADDE 67- (1) Binalarda kurulan elektrik tesisatının, kaçış yolları aydınlatmasının ve yangın algılama ve uyarı sistemlerinin, yangın hâlinde veya herhangi bir acil hâlde, binada bulunanlara zarar vermeyecek, panik çıkmasını önleyecek, binanın emniyetli bir şekilde boşaltılmasını sağlayacak ve güvenli bir ortam oluşturacak şekilde tasarlanması, tesis edilmesi ve çalışır durumda tutulması gerekir. (2) Her türlü elektrik tesisatının, kaçış yolları aydınlatmasının, acil durum aydınlatma ve yönlendirmesinin ve yangın algılama ve uyarı sistemlerinin, ilgili tesisat yönetmeliklerine ve standartlarına uygun olarak tasarlanması ve tesis edilmesi şarttır. (3) Binalarda kurulacak elektrik tesisatının, kaçış yolları aydınlatmasının ve yangın algılama ve uyarı sistemlerinin tasarımı ve uygulaması, ruhsat veren idarenin kontrol ve onayına tabidir. Sistemlerin ve cihazların periyodik kontrolü, test ve bakımları, bina sahibi veya yöneticisi ile bunların yazılı olarak sorumluluklarını devrettiği bina yetkilisince yaptırılır.   Taşınabilir söndürme cihazları (4) MADDE 99- (Değişik: 10/8/2009-2009/15316 K.) (1) Taşınabilir söndürme cihazlarının tipi ve sayısı, mekânlarda var olan durum ve risklere göre belirlenir. Buna göre; a) A sınıfı yangın çıkması muhtemel yerlerde, öncelikle çok maksatlı kuru kimyevi tozlu veya sulu, b) B sınıfı yangın çıkması muhtemel yerlerde, öncelikle kuru kimyevi tozlu, karbondioksitli veya köpüklü, c) C sınıfı yangın çıkması muhtemel yerlerde, öncelikle', 'her birinin içinden bir yangın güvenlik holünden geçilerek yangın merdivenine ulaşılıyor ise binanın genel merdiveninin korunumlu olması gerekli değildir. ç) Yapı yüksekliği 51.50 m’den yüksek olan konutlarda, birbirlerine alternatif ve yangın güvenlik holü olan ve basınçlandırılan en az 2 kaçış merdiveni yapılması şarttır. (6) Konut yapılarının farklı amaçla kullanılan bodrum katlarında, konut ile  ortak kullanılan kaçış merdivenlerinin önüne yangın güvenlik holü düzenlenmesi gerekir.', 'tuttuğu saat kadar mesai günlerinde izin verilir.  Ekiplerin çalışma esasları MADDE 128- (1) Acil durum ekiplerinin birbirleriyle işbirliği yapmaları ve karşılıklı yardımlaşmada bulunmaları esastır. (2) Ekiplerin yangın anında sevk ve idaresi, itfaiye gelinceye kadar iç düzenlemeyi uygulamakla görevli amir veya yardımcılarına aittir.  Bu süre içinde ekipler amirlerinden emir alırlar. İtfaiye gelince, bu ekipler derhal itfaiye amirinin emrine girerler. (3) Bina sahibi ve yöneticileri ile bina amirleri; ekiplerin, yapılarda meydana gelecek yangınlara müdahale etmeleri ve kurtarma işlemlerini yürütmelerinde kullanmaları için gereken malzemeleri bulundurmak zorundadırlar. Yapının büyüklüğüne, kullanım amacına, mevcut koruma sistemlerine ve oluşturulan ekip özelliklerine göre, mahalli itfaiye teşkilatı ve sivil savunma müdürlüğünün görüşü alınarak, gerekli ise gaz maskesi, teneffüs cihazı, yedek hortum, lans, hidrant anahtarı ve benzeri malzemeler bulundurulur. Bulundurulacak malzemeler, itfaiye teşkilatında kullanılan malzemelere uygun olmak zorundadır. Araç-gereç ve malzemenin bakımı ve korunması, iç düzenlemeyi uygulamakla görevli amirin sorumluluğu altında görevliler tarafından yapılır. (4) Yangın haberini alan acil durum ekipleri, kendilerine ait araç-gereç ve malzemelerini alarak derhal olay yerine hareket ederler. Olay yerinde; a) Söndürme ekibi yangın yerinin altındaki, üstündeki ve yanlarındaki odalarda gereken tertibatı alır, yangının genişlemesini önlemeye ve söndürmeye çalışırlar. b) Kurtarma ekibi önce canlıları kurtarır. Daha sonra yangında ilk kurtarılacak evrak, dosya ve diğer eşyayı, olay yerinde bulunanların da yardımı ile ve büro şeflerinin nezareti altında mümkünse çuvallara ve torbalara koyarak boşaltılmaya hazır hâle getirir. Çuval ve torbalar, bina yetkililerinin gerek görmesi hâlinde binanın henüz yanma tehlikesi olmayan kısımlarına taşınır. Yanan binanın genel olarak boşaltılmasına olay yerine gelen itfaiye amirinin veya en büyük mülki amirin', 'dosya ve diğer eşyayı, olay yerinde bulunanların da yardımı ile ve büro şeflerinin nezareti altında mümkünse çuvallara ve torbalara koyarak boşaltılmaya hazır hâle getirir. Çuval ve torbalar, bina yetkililerinin gerek görmesi hâlinde binanın henüz yanma tehlikesi olmayan kısımlarına taşınır. Yanan binanın genel olarak boşaltılmasına olay yerine gelen itfaiye amirinin veya en büyük mülki amirin emriyle başlanır. c) Koruma ekibi boşaltılan eşya ve evrakı, güvenlik güçleri veya bina yetkililerinin göstereceği bir yerde muhafaza altına alır ve yangın söndürüldükten sonra o binanın ilgililerine teslim eder. ç) İlk yardım ekibi yangında yaralanan veya hastalananlar için ilk yardım hizmeti verir. (5) Yangından haberdar olan bina sahibi, yöneticisi, amiri ile acil durum ekipleri en seri şekilde görev başına gelip, söndürme, kurtarma, koruma ve ilk yardım işlerini yürütmek zorundadır.']","Yangın güvenliği ile ilgili olarak, 634 Sayılı Kat Mülkiyeti Kanunu Madde 99 uyarınca, taşınabilir söndürme cihazlarının tipi ve sayısı, mekânlarda var olan durum ve risklere göre belirlenir. Düşük tehlike sınıfında her 500 m², orta tehlike ve yüksek tehlike sınıfında ise her 250 m² yapı inşaat alanı için 1 adet uygun tipte 6 kg’lık kuru kimyevî tozlu veya eşdeğeri gazlı yangın söndürme cihazı bulundurulması gerekmektedir. Bu nedenle, binanın büyüklüğüne ve kullanım amacına göre yangın söndürme tüpü sayısı değişiklik göstermektedir.","Binaların Yangından Korunması Hakkında Yönetmelik Madde 99 uyarınca, düşük tehlike sınıfında her 500 m2, orta ve yüksek tehlikede her 250 m2 alan için en az bir adet 6 kg'lık söndürme cihazı bulundurulmalıdır.",0.8,0.400533392235995,0.6811166240852387
Apartman yönetim planında 'kararlar salt çoğunlukla alınır' yazıyor. Plan değişikliği için bu kural geçerli mi?,"['Ek Madde 5 – (Ek:4/7/2019-7181/5 md.)  \nKat mülkiyetine tabi yapıların projesindeki hatalı blok numaralarının düzeltilebilmesi \niçin; blok bazında kat malikleri kurulunun salt çoğunluğuyla alınmış karar ile lisanslı harita ve \nkadastro bürosu veya kadastro müdürlüğü tarafından hazırlanan teknik rapor gereğince düzen-\nlenen ve ilgili idarece onaylanan yeni vaziyet planı ilgilisi tarafından tapu müdürlüğüne sunulur. \nKat mülkiyetine t abi yapıların projesindeki hatalı bağımsız bölüm numaralarının dü-\nzeltilebilmesi için; lisanslı harita ve kadastro bürosu veya kadastro müdürlüğü tarafından ha-\nzırlanan ve ilgili idarece onaylanan teknik rapor ilgilisi tarafından tapu müdürlüğüne sunulur. \nBu fıkra kapsamında yapılan düzeltmelerde ayni ve şahsi hak lehtarlarının muvafakati aranır. \n \nGeçici Madde 1 – (Ek:14/11/2007-5711/23 md.) (Değişik:9/6/2021-7327/13 md.)  \nBu maddenin yürürlüğe girmesinden önce yapı kullanma izin belgesi düzenlenen tüm \nyapılarda, Mekânsal Adres Kayıt Sistemine yüklenemeyen yapı kullanma izin belgesi ile yapı \naplikasyon projesinin yetkili idare tarafından elektronik ortamda kadastro müdürlüğüne \ngönderilmesi hâlinde, 10 uncu maddenin altıncı fıkrası hükümleri uyarınca işlem yapılır. \n \nGeçici Madde 2 – (Ek: 23/6/2009-5912/5 md.) \nBu Kanunun yürürlük tarihinden önce kurulan toplu yapılara ait yönetim planlarının, bu \nKanun hükümlerine uyarlanması amacıyla yapılacak ilk değişiklik için mevcut kat malikl eri \nkurulunun salt çoğunluğu yeterlidir. Mevcut toplu yapı yönetimleri, değiştirilen yönetim planına \ngöre yeni yöneticiler seçilinceye kadar geçici yönetim olarak görevini sürdürür. Toplu yapı yö-\nneticisi seçimi, en geç yönetim planının değiştirilmesini takip eden üç ay içinde yapılır. \n \nF) Yürürlük tarihi:810', 'Madde 70 – (Ek: 14/11/2007-5711/22 md.) \nToplu yapı kapsamındaki yapı ve yerler için tamamını kapsayan bir tek yönetim plânı \ndüzenlenir. Yönetim plânı, toplu yapı kapsamındaki bütün kat maliklerini bağlar. Yönetim \nplânının değiştirilebilmesi için, toplu yapı temsilciler kurulu üyelerinin temsil ettikleri bağım-\nsız bölümlerin tamsayısının beşte dördünün oyu şarttır. \nGeçici yönetimle ilgili yönetim plânı hükümleri, toplu yapı alanındaki bağımsız bölüm \nmaliklerinin beşte dördünün oylarıyla değiştirilebilir.  \n \nYönetici ve denetçi atama \nMadde 71 – (Ek: 14/11/2007-5711/22 md.) \nYönetim plânında başka türlü düzenlenmedikçe, blok kat malikleri kurulu blok için, \nblok niteliğinde olmayan yapıların yer aldığı parseldeki kat malikleri kendilerine özg ülenen \nortak yer ve tesisler için, toplu yapı temsilciler kurulu ise toplu yapı kapsamındaki bütün ortak \nyapı, yer ve tesisler için yönetici ve denetçi atar.  \nBlok yöneticisi ve denetçisi, bloktaki kat maliklerinin; blok niteliğinde olmayan yap ı-\nların ortak yer ve tesisleri için yönetici ve denetçi, bu yapılardaki kat maliklerinin sayı ve arsa \npayı bakımından çoğunluğu tarafından seçilir. Toplu yapı kapsamındaki bütün ortak yapı, yer \nve tesisler için yönetici ve denetçi ise, toplu yapı temsilciler kuruluna katılan yönetici ve tem-\nsilcilerin, yönettikleri ve temsil ettikleri bağımsız bölüm sa yısının salt çoğunluğunun oyu ile \natanır. \n \nOrtak giderlere katılma', '(Ek fıkra: 15/2/2018-7099/4 md.) (Değişik altıncı fıkra:9/6/2021-7327/11 md.) Yapı \nkullanma izin b elgesi düzenlenen tüm yapıların cins değişikliği işlemleri resen yapılır. Yapı \nkullanma izin belgesini düzenlemeye yetkili idare tarafından Mekânsal Adres Kayıt Sistemine \nyüklenerek elektronik ortamda kadastro müdürlüğüne gönderilen yapı kullanma izin belgesi ile \nyapı aplikasyon projesine göre kadastro müdürlüğünce tescil bildirimi düzenlenir. Tapu \nmüdürlüğüne gönderilen tescil bildirimi üzerine başkaca bir belge aranmaksızın cins değişikliği \nresen tescil edilir. Cins değişikliği yapılmış taşınmaz kat irtifakı tesisli ise, kat irtifakının tesciline \nait resmî senede ve 12 nci maddede yazılı belgelere dayalı olarak başkaca bir belge aranmaksızın \nresen kat mülkiyetine çevrilir. Bu işlemler, döner sermaye hizmet bedelinden muaftır. \n                                                           \n2 9/6/2021 tarihli ve 7327 sayılı Kanunun 11 inci maddesiyle, bu fıkranın birinci cümlesinde yer alan \n“kat karşılığı temlik sözleşmesi ve” ibaresi “kat karşılığı temlik sözleşmesi veya” şeklinde değiştirilmiş, \ncümlede yer alan “cins değişikliği,” ibaresi madde metninden çıkarılmıştır. \nKat mülkiyetine konu olmaya elverişli bir gayrimenkul üzerindeki ortaklığın giderilmesi \ndavalarında, mirasçılardan veya ortak maliklerden biri, paylaşmanın, kat mülkiyeti kurulması ve \nbağımsız bölümlerin tahsisi suretiyle yapılmasını isterse, hakim, o gayrimenkulün mülkiyetinin, \n12 nci maddede yazılı belgelere dayanılarak kat mülkiyetine çevrilmesine ve paylar denkleşti-\nrilmek suretiyle bağımsız bölümlerin ortaklara ayrı ayrı tahsisine karar verebilir. \n(Ek fıkra: 14/11/2007 -5711/3 md.) Gelirinin ortak giderlere harcanması için veya \nbaşka bir amaçla ortak yararlanmaya tahsis edilen bağımsız bölümlerin malik hanesine, bun-\nlardan yararlanan ""bağımsız bölümlerin numaraları"" yazılmak suretiyle kat mülkiyeti kütüğ ü-', 'Madde 27 – Anagayrimenkul, kat malikleri kurulunca yönetilir ve yönetim tarzı,  ka-\nnunların emredici hükümleri saklı kalmak şartiyle, bu kurul tarafından kararlaştırılır. \n \nB) Yönetim planı: \nMadde 28 – Yönetim planı yönetim tarzını, kullanma maksat ve şeklini yönetici ve \ndenetçilerin alacakları ücreti ve yönetime ait diğer hususları dü zenler.Yönetim planı, bütün \nkat maliklerini bağlıyan bir sözleşme hükmündedir. \nYönetim planında hüküm bulunmıyan hallerde, anagayrimenkulün yönetiminden do-\nğacak anlaşmazlıklar bu kanuna ve genel hükümlere göre karara bağlanır. \n(Değişik: 13/4/1983 - 2814/11 md.) Yönetim planının değiştirilmesi için bütün kat \nmaliklerinin beşte dördünün oyu şarttır. Kat maliklerinin 33 üncü maddeye göre mahkemeye \nbaşvurma hakları saklıdır. \nYönetim planı ve bunda yapılan değişiklikler, bütün kat malikleriyle onların külli ve \ncüzi haleflerini ve yönetici ve denetçileri bağlar. \nYönetim planının ve onda sonradan yapılan değişikliklerin tarihi, kat mülkiyeti kütü-\nğünün (Beyanlar) hanesinde gösterilir ve bu değişiklikler yönetim planına bağlanarak kat \nmülkiyetinin kuruluş belgeleri arasında saklanır. \n \nC) Kat malikleri kurulunun toplantısı ve kararları: \nI - Toplantı zamanı:', 'Geçici Madde 1 – Bu Kanun gereğince hazırlanması gereken yönetmel ik, Kanunun \nyürürlüğe girdiği tarihten itibaren altı ay içinde hazırlanır. \n \nGeçici Madde 2 – 13/4/1983 tarihli ve 2814 sayılı Kanunun yürürlüğe girdiği tarihten \nönce kat irtifakı kurulmuş binalarda yönetim plânı olmasa dahi 12 nci madde hükümlerine \ngöre kat mülkiyeti kurulur. \n \nGeçici Madde 3 – Bu Kanunun yürürlüğe girmesinden önce kurulan toplu yapılara ait \nyönetim plânları, yürürlük tarihinden itibaren en geç altı ay içinde bu Kanun hükümlerine \nuyarlanır. Yönetim plânında bu yönde değişiklik yapılması için  mevcut kat malikleri kurul u-\nnun salt çoğunluğu yeterlidir. Mevcut toplu yapı yönetimleri, yönetim plânı değişip buna göre \nyönetici seçilene kadar geçici yönetim olarak görevini sürdürür. Toplu yapı yöneticisi seçimi, \nen geç yönetim plânının değişimini takip eden üç ay içinde yapılır. \n634 SAYILI KANUNA EK VE DEĞİŞİKLİK GETİREN MEVZUATIN \nYÜRÜRLÜĞE GİRİŞ TARİHLERİNİ GÖSTERİR TABLO \n \nDeğiştiren Kanunun/ \nKHK’nin Numarası \n634 Sayılı Kanunun Değişen \nveya İptal Edilen Maddeleri Yürürlüğe Giriş Tarihi \n1166 51 2/1/1969 \n2814 \n2, 3, 8, 12, 13, 14, 17, 19, 20, \n22, 28, 37, 40, 49, Ek Madde 1,', 'Madde 67 – (Ek: 14/11/2007-5711/22 md.) \nToplu yapı kapsamında olup, bütünüyle bu kapsamdaki bağımsız bölümlerin ortak \nkullanma ve faydalanmasına tahsis edilmiş bulunan parsellerin malik hanesine, tahsis edildik-\nleri toplu yapı kapsamındaki diğer parsellerin ada, parsel, blok ve bağımsız bölüm numaraları \ngösterilmek suretiyle tapu siciline kaydedilir ve bu suretle tahsis edildikleri parsellerde bulu-\nnan bağımsız bölümlerin ortak yeri olur. \n                                                           \n10 14/11/2007 tarihli ve 5711 sayılı Kanunun 22 nci maddesiyle; 65 inci maddeden sonra gelmek üzere \n""Toplu Yapılara İlişkin Özel Hükümler"" başlıklı ""Dokuzuncu Bölüm"" altında aşağıdaki maddeler ek-\nlenmiş, mevcut 66 ve 67 nci maddeler, 75 ve 76 ncı maddeler olarak teselsül ettirilmiştir. \nToplu yapı kapsamında bulunan birden çok yapının ortak sosyal ve alt yapı tesisleri \nbulundukları parsel veya yapıya bakılmaksızın, tahsis edildikleri bağımsız bölümlerin ortak \nyeri sayılır. \n \nVaziyet plân ve projeleri \nMadde 68 – (Ek: 14/11/2007-5711/22 md.) \nToplu yapılarda; yapıların konumları, ortak nitelikteki yerler ve tesisler, bunların kul-\nlanılış amaç ve şekilleri, toplu yapı kapsamındaki parsel veya parsellerin tamamını kapsaya-\ncak şeki lde, bir bütün olarak ilgili makamlarca onaylanmış imar plânı hükümlerine uygun  \nolarak hazırlanmış vaziyet plânında ve projelerde belirtilir.  \nKamuya ayrılan yerlerin düzenlenmesi, işletilmesi ve bakımı, bu konuda yetkili kamu \nkurumu ile mutabakat sağlanması hâlinde, kamunun kullanımını kısıtlamamak şartıyla toplu \nyapı yönetimince üstlenilebilir. \nToplu yapı uygulamasında, kat mülkiyetinin ve kat irtifakının tesisine, aranacak belge-\nlere, tapuda yapılacak işlemlere ilişkin hususlar, Bayındırlık ve İskân Bakanlığınca hazırlana-\ncak bir yönetmelikle düzenlenir. \n \nYönetim']","634 Sayılı Kat Mülkiyeti Kanunu Madde 28 uyarınca, yönetim planının değiştirilmesi için bütün kat maliklerinin beşte dördünün oyu şarttır. Dolayısıyla, apartman yönetim planında ""kararlar salt çoğunlukla alınır"" ifadesi geçiyor olsa bile, yönetim planı değişikliği için bu kural geçerli değildir ve beşte dört çoğunluk gerekmektedir.","Hayır, 634 Sayılı KMK Madde 28 uyarınca yönetim planı değişikliği için 4/5 çoğunluk şartı emredici hükümdür. Yönetim planındaki aksine hükümler kanunun bu maddesi karşısında geçersizdir.",1.0,0.4687209635551804,0.7343094332699127
"Komşum su sızıntısı tamiri için usta girişine izin vermiyor, 'konut dokunulmazlığı' diyebilir mi?","['B. Konut dokunulmazlığı Madde 21 – (Değişik: 3/10/2001-4709/6 md.) Kimsenin konutuna dokunulamaz. Millî güvenlik, kamu düzeni, suç işlenmesinin önlenmesi, genel sağlık ve genel ahlâkın korunması veya başkalarının hak ve özgürlüklerinin korunması sebeplerinden biri veya birkaçına bağlı olarak usulüne göre verilmiş hâkim kararı olmadıkça; yine bu sebeplere bağlı olarak gecikmesinde sakınca bulunan hallerde de kanunla yetkili kılınmış merciin yazılı emri bulunmadıkça; kimsenin konutuna girilemez, arama yapılamaz ve buradaki eşyaya el konulamaz. Yetkili merciin kararı yirmidört saat içinde görevli hâkimin onayına sunulur. Hâkim, kararını el koymadan itibaren kırksekiz saat içinde açıklar; aksi halde, el koyma kendiliğinden kalkar.  XII. Mülkiyet hakkı Madde 35 – Herkes, mülkiyet ve miras haklarına sahiptir. Bu haklar, ancak kamu yararı amacıyla, kanunla sınırlanabilir. Mülkiyet hakkının kullanılması toplum yararına aykırı olamaz.  A. Hak arama hürriyeti Madde 36 – Herkes, meşru vasıta ve yollardan faydalanmak suretiyle yargı mercileri önünde davacı veya davalı olarak iddia ve savunma ile adil yargılanma hakkına sahiptir.[16] Hiçbir mahkeme, görev ve yetkisi içindeki davaya bakmaktan kaçınamaz.  IV. Çalışma ve sözleşme hürriyeti Madde 48 – Herkes, dilediği alanda çalışma ve sözleşme hürriyetlerine sahiptir. Özel teşebbüsler kurmak serbesttir. Devlet, özel teşebbüslerin milli ekonominin gereklerine ve sosyal amaçlara uygun yürümesini, güvenlik ve kararlılık içinde çalışmasını sağlayacak tedbirleri alır.']","Türkiye Cumhuriyeti Anayasası Madde 21 uyarınca, kimsenin konutuna dokunulamaz. Ancak, konut dokunulmazlığı, yalnızca usulüne göre verilmiş hâkim kararı veya kanunla yetkili kılınmış merciin yazılı emri ile aşılabilir. Su sızıntısı tamiri için ustanın girmesi gerektiğinde, bu durum acil bir durum olarak değerlendirilebilir ve komşunun izni olmadan da gerekli müdahale yapılabilir. Ancak, bu tür bir müdahale için öncelikle yasal süreçlerin izlenmesi önemlidir. Dolayısıyla, komşunuzun ""konut dokunulmazlığı"" iddiası, yasal çerçevede geçerli bir gerekçe olmayabilir.","Hayır. Türkiye Cumhuriyeti Anayasası Madde 21 konut dokunulmazlığını korur ancak 634 Sayılı KMK Madde 23, ortak yerlerdeki veya diğer bölümlerdeki arızaların giderilmesi için malikin kendi bölümüne girişe izin vermesini zorunlu kılar. İzin verilmezse Madde 33 uyarınca hakim müdahalesi istenir.",0.42857142857142855,0.4092732924651392,0.34174223516088204
Ev sahibi 'Aidat borcu için kiracıya gidin' diyebilir mi?,"['ya\t da\tönemli\t ölçüde\t engellemesi\t ve\t verilen\t sürede\t giderilmemesi\t hâlinde\t kiracı,\t sözleşmeyi\tfeshedebilir. Kiraya veren, kiralanandaki ayıbı gidermek yerine, uygun bir süre içinde ayıpsız benzeriyle değiştirebilir. Kiraya veren, kiracıya aynı malın ayıpsız bir benzerini hemen vererek ve uğradığı zararın tamamını gidererek, onun seçimlik haklarını kullanmasını önleyebilir.', 'D. Kiracının borçları I. Kira bedelini ödeme borcu 1. Genel olarak MADDE\t313-\tKiracı, kira bedelini ödemekle yükümlüdür. \t 2. İfa zamanı MADDE\t 314-\tKiracı, aksine sözleşme ve yerel âdet olmadıkça, kira bedelini ve gerekiyorsa yan giderleri, her ayın sonunda ve en geç kira süresinin bitiminde ödemekle yükümlüdür.   3. Kiracının temerrüdü MADDE\t 315-\tKiracı, kiralananın tesliminden sonra muaccel olan kira bedelini veya yan gideri ödeme borcunu ifa etmezse, kiraya veren kiracıya yazılı olarak bir süre verip, bu sürede de ifa etmeme durumunda, sözleşmeyi feshedeceğini bildirebilir. Kiracıya verilecek süre en az on gün, konut ve çatılı işyeri kiralarında ise en az otuz gündür. Bu süre, kiracıya yazılı bildirimin yapıldığı tarihi izleyen günden itibaren işlemeye başlar.   II. Özenle kullanma ve komşulara saygı gösterme borcu MADDE\t 316-\tKiracı, kiralananı, sözleşmeye uygun olarak özenle kullanmak ve kiralananın bulunduğu taşınmazda oturan kişiler ile komşulara gerekli saygıyı göstermekle yükümlüdür. Kiracının bu yükümlülüğüne aykırı davranması durumunda kiraya veren, konut ve çatılı işyeri kirasında, en az otuz gün süre vererek, aykırılığın giderilmesi, aksi takdirde sözleşmeyi feshedeceği konusunda yazılı bir ihtarda bulunur. Diğer kira ilişkilerinde ise, kiraya veren, kiracıya önceden bir ihtarda bulunmaksızın, yazılı bir bildirimle sözleşmeyi hemen feshedebilir. Konut\tve\tçatılı\tişyeri\tkirasında,\tkiracının\tkiralanana\tkasten\tağır\tbir\tzarar\tvermesi,\tkiracıya\tverilecek\tsürenin\tyararsız\tolacağının\tanlaşılması\tveya\tkiracının\tbu\tyükümlülüğe\taykırı\t davranışının\t kiraya\t veren\t veya\t aynı\t taşınmazda\t oturan\t kişiler\t ile\t komşular\tbakımından\tçekilmez\tolması\tdurumlarında\tkiraya\tveren,\tyazılı\tbir\tbildirimle\tsözleşmeyi\themen\tfeshedebilir. \t III. Temizlik ve bakım giderlerini ödeme borcu MADDE\t 317- Kiracı, kiralananın olağan kullanımı için gerekli temizlik ve bakım giderlerini ödemekle yükümlüdür. Bu konuda yerel âdete de bakılır.', '3. Yapı malikinin sorumluluğu a. Giderim yükümlülüğü MADDE\t 69- Bir binanın veya diğer yapı eserlerinin maliki, bunların yapımındaki bozukluklardan veya bakımındaki eksikliklerden doğan zararı gidermekle yükümlüdür. İntifa ve oturma hakkı sahipleri de, binanın bakımındaki eksikliklerden doğan zararlardan, malikle birlikte müteselsilen sorumludurlar. Sorumluların, bu sebeplerle kendilerine karşı sorumlu olan diğer kişilere rücu hakkı saklıdır.   b. Zarar tehlikesini önleme MADDE\t 70- Bir başkasına ait bina veya\t diğer\t yapı\t eserlerinden\t zarar\t görme\ttehlikesiyle\tkarşılaşan\tkişi, bu tehlikenin giderilmesi için gerekli önlemlerin alınmasını hak sahiplerinden isteyebilir. Kişilerin\tve\tmalların\tkorunması\thakkındaki\tkamu\thukuku\tkuralları\tsaklıdır.  2. Kiralananın sonradan ayıplı hâle gelmesinden sorumluluk a. Genel olarak MADDE\t 305-\tKiralanan sonradan ayıplı duruma gelirse kiracı, kiraya verenden ayıpların giderilmesini veya kira bedelinden ayıpla orantılı bir indirim yapılmasını ya da zararının giderilmesini isteyebilir. Ancak, zararın giderilmesi istemi diğer seçimlik hakların kullanılmasını önlemez. Önemli ayıp durumunda kiracının sözleşmeyi fesih hakkı saklıdır.   b. Ayıbın giderilmesini isteme ve fesih MADDE\t 306-\tKiracı, kiraya verenden kiralanandaki ayıbın uygun bir sürede giderilmesini isteyebilir; bu sürede ayıp giderilmezse kiracı, ayıbı kiraya veren hesabına gidertebilir ve bundan doğan alacağını kira bedelinden indirebilir veya kiralananın ayıpsız bir benzeri ile değiştirilmesini isteyebilir. Ayıbın,\t kiralananın\t öngörülen\t kullanıma\t elverişliliğini\t ortadan\t kaldırması\t ya\t da\tönemli\t ölçüde\t engellemesi\t ve\t verilen\t sürede\t giderilmemesi\t hâlinde\t kiracı,\t sözleşmeyi\tfeshedebilir. Kiraya veren, kiralanandaki ayıbı gidermek yerine, uygun bir süre içinde ayıpsız benzeriyle değiştirebilir. Kiraya veren, kiracıya aynı malın ayıpsız bir benzerini hemen vererek ve uğradığı zararın tamamını gidererek, onun seçimlik haklarını kullanmasını önleyebilir.']","6098 Sayılı Türk Borçlar Kanunu Madde 314 uyarınca, kiracı, kira bedelini ve gerekiyorsa yan giderleri, her ayın sonunda ve en geç kira süresinin bitiminde ödemekle yükümlüdür. Ancak, aidat borçları genellikle kiracıya ait yan giderler arasında sayılabilir. Dolayısıyla, ev sahibi aidat borcu için kiracıya başvurabilir, ancak bu durumun sözleşme şartlarına ve yerel uygulamalara bağlı olduğunu unutmamak gerekir.","Hayır, 634 Sayılı KMK Madde 22 uyarınca kat maliki giderlerden asıl sorumludur. Kiracı sadece ödemekle yükümlü olduğu kira miktarı ile sınırlı olarak malikle birlikte müştereken ve müteselsilen sorumludur.",0.5,0.3410086472613436,0.15402781270426325
"Komşum sürekli gürültü yapıyor ve kötü koku yayıyor, kanuni hakkım nedir?","['“özürlünün” ibareleri sırasıyla “Engellilerin” ve “engellinin”  şeklinde değiştirilmiştir. \nüzerine ısı yalıtımı, ısıtma sisteminin yakıt dönüşümü ve ısıtma sisteminin merkezi sistemden \nferdi sisteme veya ferdi sistemden merkezi sisteme dönüştürülmesi, kat maliklerinin sayı ve \narsa payı çoğunl uğu i le verecekleri karar üzerine yapılır. Ancak toplam inşaat alanı ikibin \nmetrekare ve üzeri olan binalarda merkezi ısıtma sisteminin ferdi ısıtma sistemine dönüştü-\nrülmesi, kat maliklerinin sayı ve arsa payı olarak oybirliği ile verecekleri karar üzerine yapılır. \nBu konuda yapılacak ortak işlerin giderleri arsa payı oranına göre ödenir. Merkezi ısıtma sis-\ntemlerinde ısınma giderl erinin paylaştırılmasına ilişkin usûl ve esaslar Bayındırlık ve İskan \nBakanlığı tarafından yürürlüğe konulacak yönetmelikle düzenlenir.  \n(Değişik beşinci fıkra: 18/4/2007-5627/16 md.) Isıtma sisteminin merkezi sistemden \nferdi sisteme veya ferdi sistemden merkezi sisteme dönüştürülmesine karar verilmesi halinde, \nyönetim planının bu karara aykırı hükümleri değiştirilmiş sayılır. \n \nII - Çok masraflı ve lüks olanlar:', 'Ek Madde 3 – (Ek:13/4/1983 - 2814/15 md.; Mülga: 14/11/2007-5711/24 md.) \n \nKat irtifakına geçiş: \nEk Madde 4 – (Ek: 13/4/1983 - 2814/15 md.) \nBeş veya daha fazla kişi tarafı ndan üzerinde bir veya birden çok yapı yaptırılmak \namacıyla birlikte bir arsa edinilmiş olması ve pay sahiplerinden en az beşte dördünün kat irti-\nfakına geçiş kon usunda aldığı karara uyulmaması halinde, karara uymayan pay sahiplerinin \ngayrimenkuldeki paylarının iptaline ve bu payların, isteyen diğer pay sahipleri adına tesciline \nsulh mahkemesi tarafından aşağıdaki şartlarla karar verilir: \na) Müşterek gayrimenkulün yukarıda belirtilen amaçla edinildiğinin ispat edilmiş olması, \nb) Müşterek maliklerin yukarıda açıklanan çoğunluğunun kat irtifakına geçiş kararına \nveya bununla ilgili yükümlülüklere noterlikçe yapılan tebligata rağmen iki ay içinde uyulmamış \nolması, \nc) Karara uymayan müşterek maliklerin paylarının mahkemece tespit edilen rayiç be-\ndelinin mahkeme veznesine depo edilmesi. \n \nHatalı blok veya bağımsız bölüm numaralarının düzeltilmesi', 'bankada kendi adına ve fakat anagayrimenkulün yönetici sıfatı gösterilmek suretiyle, hesap \naçtırılması; \nk) Kat malikleri kurulunun toplantıya çağırılması. \nl) (Ek: 4/4/2015 -6645/82 md.) Anagayrimenkulde bulunan asansörlerin güvenli bir \nşekilde işletilmesinin sağlanması amacıyla aylık bakımları ile yıllık kontrollerinin ilgili teknik \ndüzenlemelere uygun şekilde yaptırılması ve bu işlemlere ilişkin ücretlerin ödenmesi. \n(Ek fıkra: 4/4/2015-6645/82 md.) Bu Kanunun 34 üncü maddesinde belirtilen şartları \ntaşımasına rağmen yönetici ataması yapılmayan anagayrimenkulde, birinci fıkrada sayılan \nişlerin yaptırılmasından kat malikleri müştereken sorumludur. \n \n2. Defter tutulması ve belgelerin saklanması:', 'Madde 23 – Kat maliklerinden birinin bağımsız bölümünde veya bu bölümdeki tesis-\nlerde meydana gelen bir hasar veya bozukluğun onarımı veya giderilmes i veya tesislerin ye-\nniden yapılması ile yapı güvenliğiyle ilgili olarak yapılması gerekli görülen teknik inceleme-\nler için diğer bir bağımsız bölüme girmek gerekiyorsa, o bölümün maliki veya o bölümde \nbaşka sıfatla otura nlar, giriş müsaadesi vermeye ve böl ümde gerekli işlerin yapılmasına ka t-\nlanmaya mecburdurlar.6 \n                                                           \n6 14/11/2007 tarihli ve 5711 sayılı Kanunun 11 inci maddesiyle; bu fıkrada yer alan ""tesislerin yeniden \nyapılması"" ibaresinden sonra gelmek üzere ""ile yapı güvenliğiyle ilgili olarak yapılması gerekli görülen \nteknik incelemeler"" ibaresi eklenmiştir. \nAnagayrimenkulün bir kısmının harap olması halinde, harap olan bağımsız bölüm ve \neklentilerinin veya ortak yerlerin veya bağımsız bölümdeki tesislerin yeniden yapılması için, \nsağlam kalan bağımsız bölümlerin içinden veya dışından faydalanılması gerekiyorsa, o bö-\nlümlerin malikleri veya orada başka sıfatla oturanlar buna müsaade etmeye mecburdurlar. \nYukarıdaki fıkralarda yazılı müsaade yüzünden, kat maliklerinin veya orada başka sı-\nfatla oturanların uğrayacakları zararı, lehine müsaade verilen bağımsız bölüm malikleri derhal \nödemekle yükümlüdürler.  \n \nVII - Yasak işler:', 'ğince verilen emre rağmen, bu kanunda yazılı borç ve yükümleri yerine getirmemek suretiyle \nöteki kat maliklerinin haklarını ihlal etmekte devamlı olarak bir yıl ısrar edilmesi; \nc) Kendi bağımsız bölümünü randevu evi veya kumarhane veya benzeri yer olarak \nkullanmak suretiyle ahlak ve adaba aykırı harekette bulunması.  \n(Değişik dördüncü fıkra: 14/11/2007-5711/12 md.) Bu maddedeki dava hakkı, devir \nkonusunda kat maliklerince alınan dava açma kararının öğrenilmesi tarihinden başlay arak altı \nay ve her halde dava hakkının doğumundan başlayarak beş yıl içinde kullanı lmazsa veya dava \nsebebi ortadan kalkmışsa düşer. \n \nB) Kat irtifakı sahiplerinin borçları:', 'Madde 42 – Kat malikleri,anagayrimenkulün ortak yerlerinde kendi başlarında bir deği-\nşiklik yapamazlar; ortak yerlerin düzgün veya bunları kullanmanın daha rahat ve kolay bir hale \nkonulmasına veya bu yerlerden elde edilecek faydanın çoğaltılmasına yarıyacak bütün yenilik \nve ilaveler, kat maliklerinin sayı ve arsa payı çoğunluğu ile verecekleri karar üzerine yapılır. \n(Ek fıkra: 1/7/2005 -5378/19 md.) Engellilerin yaşamı için zorunluluk göstermesi \nhâlinde, proje tadili kat maliklerinin en geç üç ay içerisinde yapacağı toplantıda görüşülerek \nsayı ve arsa payı ç oğunluğu ile karara bağlanır. Toplantının bu süre iç erisinde yapılamaması \nveya tadilat talebinin çoğunlukla kabul edilmemesi durumunda; ilgili kat malikinin talebi üze-\nrine bina güve nliğinin tehlikeye sokulmadığını bildirir komisyon raporuna istinaden ilgili \nmercilerden alınacak  tasdikli  proje değişikliği veya krokiye göre inşaat, onarım ve tesis yapı-\nlır. İlgili merciler, tasdikli proje değişikliği veya kroki taleplerini en geç altı ay içinde sonuç-\nlandırır.  Komisyonun teşkili, çalışma usûlü ile engellinin kullanımından sonraki süreç ile \nilgili usûl ve esaslar Bayındırlık ve İskan Bakanlığı ile Özürlüler İdaresi Başkanlığı tarafından \nmüştereken hazırlanacak yönetmelikle belirlenir.7 \nBu işlerin giderleri, yeniliklerden faydalananlar tarafından, faydalanma oranına göre, \nödenir. \n(Değişik dördüncü fıkra : 18/4/20 07-5627/16 md.) Kat maliklerinden birinin isteği \n                                                           \n7 25/4/2013 tarihli ve 6462 sayılı Kanunun 1 inci maddesiyle, bu fıkrada yer alan “Özürlülerin” ve \n“özürlünün” ibareleri sırasıyla “Engellilerin” ve “engellinin”  şeklinde değiştirilmiştir. \nüzerine ısı yalıtımı, ısıtma sisteminin yakıt dönüşümü ve ısıtma sisteminin merkezi sistemden \nferdi sisteme veya ferdi sistemden merkezi sisteme dönüştürülmesi, kat maliklerinin sayı ve \narsa payı çoğunl uğu i le verecekleri karar üzerine yapılır. Ancak toplam inşaat alanı ikibin', 'D. Kiracının borçları I. Kira bedelini ödeme borcu 1. Genel olarak MADDE\t313-\tKiracı, kira bedelini ödemekle yükümlüdür. \t 2. İfa zamanı MADDE\t 314-\tKiracı, aksine sözleşme ve yerel âdet olmadıkça, kira bedelini ve gerekiyorsa yan giderleri, her ayın sonunda ve en geç kira süresinin bitiminde ödemekle yükümlüdür.   3. Kiracının temerrüdü MADDE\t 315-\tKiracı, kiralananın tesliminden sonra muaccel olan kira bedelini veya yan gideri ödeme borcunu ifa etmezse, kiraya veren kiracıya yazılı olarak bir süre verip, bu sürede de ifa etmeme durumunda, sözleşmeyi feshedeceğini bildirebilir. Kiracıya verilecek süre en az on gün, konut ve çatılı işyeri kiralarında ise en az otuz gündür. Bu süre, kiracıya yazılı bildirimin yapıldığı tarihi izleyen günden itibaren işlemeye başlar.   II. Özenle kullanma ve komşulara saygı gösterme borcu MADDE\t 316-\tKiracı, kiralananı, sözleşmeye uygun olarak özenle kullanmak ve kiralananın bulunduğu taşınmazda oturan kişiler ile komşulara gerekli saygıyı göstermekle yükümlüdür. Kiracının bu yükümlülüğüne aykırı davranması durumunda kiraya veren, konut ve çatılı işyeri kirasında, en az otuz gün süre vererek, aykırılığın giderilmesi, aksi takdirde sözleşmeyi feshedeceği konusunda yazılı bir ihtarda bulunur. Diğer kira ilişkilerinde ise, kiraya veren, kiracıya önceden bir ihtarda bulunmaksızın, yazılı bir bildirimle sözleşmeyi hemen feshedebilir. Konut\tve\tçatılı\tişyeri\tkirasında,\tkiracının\tkiralanana\tkasten\tağır\tbir\tzarar\tvermesi,\tkiracıya\tverilecek\tsürenin\tyararsız\tolacağının\tanlaşılması\tveya\tkiracının\tbu\tyükümlülüğe\taykırı\t davranışının\t kiraya\t veren\t veya\t aynı\t taşınmazda\t oturan\t kişiler\t ile\t komşular\tbakımından\tçekilmez\tolması\tdurumlarında\tkiraya\tveren,\tyazılı\tbir\tbildirimle\tsözleşmeyi\themen\tfeshedebilir. \t III. Temizlik ve bakım giderlerini ödeme borcu MADDE\t 317- Kiracı, kiralananın olağan kullanımı için gerekli temizlik ve bakım giderlerini ödemekle yükümlüdür. Bu konuda yerel âdete de bakılır.', 'ya\t da\tönemli\t ölçüde\t engellemesi\t ve\t verilen\t sürede\t giderilmemesi\t hâlinde\t kiracı,\t sözleşmeyi\tfeshedebilir. Kiraya veren, kiralanandaki ayıbı gidermek yerine, uygun bir süre içinde ayıpsız benzeriyle değiştirebilir. Kiraya veren, kiracıya aynı malın ayıpsız bir benzerini hemen vererek ve uğradığı zararın tamamını gidererek, onun seçimlik haklarını kullanmasını önleyebilir.', '3. Yapı malikinin sorumluluğu a. Giderim yükümlülüğü MADDE\t 69- Bir binanın veya diğer yapı eserlerinin maliki, bunların yapımındaki bozukluklardan veya bakımındaki eksikliklerden doğan zararı gidermekle yükümlüdür. İntifa ve oturma hakkı sahipleri de, binanın bakımındaki eksikliklerden doğan zararlardan, malikle birlikte müteselsilen sorumludurlar. Sorumluların, bu sebeplerle kendilerine karşı sorumlu olan diğer kişilere rücu hakkı saklıdır.   b. Zarar tehlikesini önleme MADDE\t 70- Bir başkasına ait bina veya\t diğer\t yapı\t eserlerinden\t zarar\t görme\ttehlikesiyle\tkarşılaşan\tkişi, bu tehlikenin giderilmesi için gerekli önlemlerin alınmasını hak sahiplerinden isteyebilir. Kişilerin\tve\tmalların\tkorunması\thakkındaki\tkamu\thukuku\tkuralları\tsaklıdır.  2. Kiralananın sonradan ayıplı hâle gelmesinden sorumluluk a. Genel olarak MADDE\t 305-\tKiralanan sonradan ayıplı duruma gelirse kiracı, kiraya verenden ayıpların giderilmesini veya kira bedelinden ayıpla orantılı bir indirim yapılmasını ya da zararının giderilmesini isteyebilir. Ancak, zararın giderilmesi istemi diğer seçimlik hakların kullanılmasını önlemez. Önemli ayıp durumunda kiracının sözleşmeyi fesih hakkı saklıdır.   b. Ayıbın giderilmesini isteme ve fesih MADDE\t 306-\tKiracı, kiraya verenden kiralanandaki ayıbın uygun bir sürede giderilmesini isteyebilir; bu sürede ayıp giderilmezse kiracı, ayıbı kiraya veren hesabına gidertebilir ve bundan doğan alacağını kira bedelinden indirebilir veya kiralananın ayıpsız bir benzeri ile değiştirilmesini isteyebilir. Ayıbın,\t kiralananın\t öngörülen\t kullanıma\t elverişliliğini\t ortadan\t kaldırması\t ya\t da\tönemli\t ölçüde\t engellemesi\t ve\t verilen\t sürede\t giderilmemesi\t hâlinde\t kiracı,\t sözleşmeyi\tfeshedebilir. Kiraya veren, kiralanandaki ayıbı gidermek yerine, uygun bir süre içinde ayıpsız benzeriyle değiştirebilir. Kiraya veren, kiracıya aynı malın ayıpsız bir benzerini hemen vererek ve uğradığı zararın tamamını gidererek, onun seçimlik haklarını kullanmasını önleyebilir.', 'III.\tKomşu\thakkı 1.\tKullanma\tbiçimi Madde\t 737-\tHerkes,\t taşınmaz\t mülkiyetinden\t doğan\t yetkileri\t kullanırken\t ve\tözellikle\t işletme\t faaliyetini\t sürdürürken,\t komşularını\t olumsuz\t şekilde\t etkileyecek\ttaşkınlıktan\tkaçınmakla\tyükümlüdür. Özellikle,\ttaşınmazın\tdurumuna,\tniteliğine\tve\tyerel\tâdete\tgöre\tkomşular\tarasında\thoş\tgörülebilecek\tdereceyi\taşan\tduman,\tbuğu,\tkurum,\ttoz,\tkoku\tçıkartarak,\tgürültü\tveya\tsarsıntı\tyaparak\trahatsızlık\tvermek\tyasaktır. Yerel\tâdete\tuygun\tve\tkaçınılmaz\ttaşkınlıklardan\tdoğan\tdenkleştirmeye\tilişkin\thaklar\tsaklıdır.', 've\t yönetime\t ilişkin\t kararların\t sonradan\tpaydaş\t olan\t veya\t pay\t üzerinde\t aynî\t hak\t kazananları\t bağlaması\t için,\t bunların\t tapu\tkütüğüne\tşerh\tedilmesi\tgerekir. \t 6.\tPaydaşlıktan\tçıkarma a.\tPaydaşın\tçıkarılması Madde\t696-\tKendi\ttutum\tve\tdavranışlarıyla\tveya\tmalın\tkullanılmasını\tbıraktığı\tya\tda\tfiillerinden\t sorumlu\t olduğu\t kişilerin\t tutum\t ve\t davranışlarıyla\t diğer\t paydaşların\t tamamına\tveya\tbir\tkısmına\tkarşı\tolan\tyükümlülüklerini\tağır\tbiçimde\tçiğneyen\tpaydaş,\tbu\tyüzden\tonlar\tiçin\t paylı\t mülkiyet\t ilişkisinin\t devamını\t çekilmez\t hâle\t getirmişse,\t mahkeme\t kararıyla\tpaydaşlıktan\tçıkarılabilir. Davanın\t açılması,\t aksi\t kararlaştırılmış\t olmadıkça,\t pay\t ve\t paydaş\t çoğunluğuyla\tkarar\tverilmesine\tbağlıdır. Hâkim,\t çıkarma\t istemini\t haklı\t gördüğü\t takdirde,\t çıkarılacak\t paydaşın\t payını\tkarşılayacak\tkısmı\tmaldan\tayırmaya\tolanak\tvarsa,\tbu\tayırmayı\tyaparak\tayrılan\tparçanın\tpaylı\tmülkiyetten\tçıkarılana\tözgülenmesine\tkarar\tverir.', 'mülkiyetin\t devamına\t ilişkin\t sözleşmeler,\t resmî\tşekle\tbağlıdır\tve\ttapu\tkütüğüne\tşerh\tverilebilir. Uygun\tolmayan\tzamanda\tpaylaşma\tisteminde\tbulunulamaz. \t b.\tPaylaşma\tbiçimi Madde\t 699-\tPaylaşma,\t malın\t aynen\t bölüşülmesi\t veya\t pazarlık\t ya\t da\t artırmayla\tsatılarak\tbedelinin\tbölüşülmesi\tbiçiminde\tgerçekleştirilir. Paylaşma\t biçiminde\t uyuşma\t sağlanamazsa,\t paydaşlardan\t birinin\t istemi\t üzerine\thâkim,\tmalın\taynen\tbölünerek\tpaylaştırılmasına,\tbölünen\tparçaların\tdeğerlerinin\tbirbirine\tdenk\t düşmemesi\t hâlinde\t eksik\t değerdeki\t parçaya\t para\t eklenerek\t denkleştirme\tsağlanmasına\tkarar\tverir. Bölme\tistemi\tdurum\tve\tkoşullara\tuygun\tgörülmezse\tve\tözellikle\tpaylı\tmalın\tönemli\tbir\t değer\t kaybına\t uğramadan\t bölünmesine\t olanak\t yoksa,\t açık\t artırmayla\t satışa\thükmolunur.\t Satışın\t paydaşlar\t arasında\t artırmayla\t yapılmasına\t karar\t verilmesi,\t bütün\tpaydaşların\trızasına\tbağlıdır. c.\tİntifa\thakkı\tsahibinin\tdurumu \t Madde\t700-\tBir\tpaydaşın\tkendi\tpayı\tüzerinde\tintifa\thakkı\tkurması\thâlinde,\tdiğer\tpaydaşlardan\t biri\t intifa\t hakkının\t kurulduğunun\t kendisine\t tebliğinden\t başlayarak\t üç\t ay\tiçinde\t paylaşma\t isteminde\t bulunursa;\t satış\t yoluyla\t paylaşmada\t intifa\t hakkı,\t buna\t ilişkin\tpaya\tdüşecek\tbedel\tüzerinde\tdevam\teder.', ""Aynen\tayrılmasına\tolanak\tbulunmayan\tmaldaki\tpayın\tdava\ttarihindeki\tdeğeriyle\tkendilerine\t devrini\t isteyen\t paydaş\t veya\t paydaşlar\t bu\t istemlerini\t paydaşlıktan\t çıkarma\tistemi\t ile\t birlikte\t ileri\t sürmek\t zorundadırlar.\t Hâkim,\t hüküm\t vermeden\t önce\t re'sen\tbelirleyeceği\tuygun\tbir\tsüre\tiçinde\tpay\tdeğerinin\tödenmesine\tveya\ttevdiine\tkarar\tverir.\tDavanın\tkabulü\thâlinde\tpayın\tistemde\tbulunan\tadına\ttesciline\thükmolunur. Payı\t karşılayacak\t kısım\t maldan\t aynen\t ayrılamaz\t ve\t bu\t payı\t isteyen\t paydaş\t da\tbulunmazsa\t hâkim,\t davalıya\t payını\t devretmesi\t için\t bir\t süre\t belirler\t ve\t bu\t süre\t içinde\tdevredilmeyen\tpayın\taçık\tartırmayla\tsatışına\tkarar\tverir.\tSatış\tkararı,\tcebrî\ticra\tyoluyla\tparaya\tçevirmeye\tilişkin\thükümler\tuyarınca\tyerine\tgetirilir. \t b.\tDiğer\thak\tsahiplerinin\tçıkarılması Madde\t 697-\tBir\t paydaşın\t çıkarılmasına\t ilişkin\t hükümler,\t kıyas\t yoluyla,\t pay\tüzerinde\t intifa\t veya\t diğer\t bir\t aynî\t ya\t da\t tapuya\t şerh\t edilmiş\t kişisel\t yararlanma\t hakkı\tsahipleri\thakkında\tda\tuygulanır.\tAncak,\tdevri\tcaiz\tolmayan\tbir\thakkın\tuygun\tbir\ttazminat\tkarşılığında\tsona\termesine\tkarar\tverilir. \t 7.\tPaylı\tmülkiyetin\tsona\termesi a.\tPaylaşma\tistemi Madde\t 698-\tHukukî\t bir\t işlem\t gereğince\t veya\t paylı\t malın\t sürekli\t bir\t amaca\tözgülenmiş\tolması\tsebebiyle\tpaylı\tmülkiyeti\tdevam\tettirme\tyükümlülüğü\tbulunmadıkça,\tpaydaşlardan\ther\tbiri\tmalın\tpaylaşılmasını\tisteyebilir. Paylaşmayı\t isteme\t hakkı,\t hukukî\t bir\t işlemle\t en\t çok\t on\t yıllık\t süre\t ile\tsınırlandırılabilir.\t Taşınmazlarda\t paylı\t mülkiyetin\t devamına\t ilişkin\t sözleşmeler,\t resmî\tşekle\tbağlıdır\tve\ttapu\tkütüğüne\tşerh\tverilebilir. Uygun\tolmayan\tzamanda\tpaylaşma\tisteminde\tbulunulamaz. \t b.\tPaylaşma\tbiçimi Madde\t 699-\tPaylaşma,\t malın\t aynen\t bölüşülmesi\t veya\t pazarlık\t ya\t da\t artırmayla\tsatılarak\tbedelinin\tbölüşülmesi\tbiçiminde\tgerçekleştirilir. Paylaşma\t biçiminde\t uyuşma\t sağlanamazsa,\t paydaşlardan\t birinin\t istemi"", 'd.\tOlağanüstü\työnetim\tişleri\tve\ttasarruflar Madde\t 692-\tPaylı\t malın\t özgülendiği\t amacın\t değiştirilmesi,\t korumanın\t veya\tolağan\tşekilde\tkullanmanın\tgerekli\tkıldığı\tölçüyü\taşan\tyapı\tişlerine\tgirişilmesi\tveya\tpaylı\tmalın\ttamamı\tüzerinde\ttasarruf\tişlemlerinin\tyapılması,\toybirliğiyle\taksi\tkararlaştırılmış\tolmadıkça,\tbütün\tpaydaşların\tkabulüne\tbağlıdır. Paylar\t üzerinde\t taşınmaz\t rehni\t veya\t taşınmaz\t yükü\t kurulmuşsa,\t paydaşlar\t malın\ttamamını\tbenzer\thaklarla\tkayıtlayamazlar. \t 3.\tYararlanma,\tkullanma\tve\tkoruma Madde\t693-\tPaydaşlardan\ther\tbiri,\tdiğerlerinin\thakları\tile\tbağdaştığı\tölçüde\tpaylı\tmaldan\tyararlanabilir\tve\tonu\tkullanabilir. Uyuşmazlık\thâlinde\tyararlanma\tve\tkullanma\tşeklini\thâkim\tbelirler.\tBu\tbelirleme,\tpaylı\tmalın\tkullanılmasının\tzaman\tveya\tyer\titibarıyla\tpaydaşlar\tarasında\tbölünmesi\tbiçiminde\tde\tolabilir. Paydaşlardan\t her\t biri,\t bölünemeyen\t ortak\t menfaatlerin\t korunmasını\t diğer\tpaydaşları\ttemsilen\tsağlayabilir. \t 4.\tGiderler\tve\tyükümlülükler Madde\t 694-\tPaylı\t mülkiyetten\t doğan\t veya\t paylı\t malı\t ilgilendiren\t yönetim\tgiderleri,\t vergiler\t ve\t diğer\t yükümlülükler,\t aksine\t bir\t hüküm\t bulunmadıkça,\t paydaşlar\ttarafından\tpayları\toranında\tkarşılanır. Payına\t düşenden\t fazlasını\t ödemiş\t bulunan\t paydaş,\t diğerlerine\t payları\t oranında\trücu\tedebilir. \t 5.\tKararların\tbağlayıcılığı Madde\t 695-\tYararlanma,\t kullanma\t ve\t yönetime\t ilişkin\t konularda\t paydaşların\tyaptıkları\t düzenleme\t ve\t aldıkları\t kararlar\t ile\t mahkemece\t verilen\t kararlar,\t sonradan\tpaydaş\tolan\tveya\tpay\tüzerinde\taynî\thak\tkazanan\tkimseleri\tde\tbağlar. Taşınmazlarda\t yararlanma,\t kullanma\t ve\t yönetime\t ilişkin\t kararların\t sonradan\tpaydaş\t olan\t veya\t pay\t üzerinde\t aynî\t hak\t kazananları\t bağlaması\t için,\t bunların\t tapu\tkütüğüne\tşerh\tedilmesi\tgerekir. \t 6.\tPaydaşlıktan\tçıkarma a.\tPaydaşın\tçıkarılması Madde\t696-\tKendi\ttutum\tve\tdavranışlarıyla\tveya\tmalın\tkullanılmasını\tbıraktığı\tya\tda\tfiillerinden\t sorumlu\t olduğu\t kişilerin\t tutum\t ve\t davranışlarıyla\t diğer\t paydaşların', 'c.\tArazinin\tmülkiyetinin\tmalzeme\tsahibine\tverilmesi Madde\t 724-\tYapının\t değeri\t açıkça\t arazinin\t değerinden\t fazlaysa,\t iyiniyetli\t taraf\tuygun\t bir\t bedel\t karşılığında\t yapının\t ve\t arazinin\t tamamının\t veya\t yeterli\t bir\t kısmının\tmülkiyetinin\tmalzeme\tsahibine\tverilmesini\tisteyebilir.  C.\tBirlikte\tmülkiyet I.\tPaylı\tmülkiyet 1.\tGenel\tkurallar Madde\t688-\tPaylı\tmülkiyette\tbirden\tçok\tkimse,\tmaddî\tolarak\tbölünmüş\tolmayan\tbir\tşeyin\ttamamına\tbelli\tpaylarla\tmaliktir. Başka\ttürlü\tbelirlenmedikçe,\tpaylar\teşit\tsayılır. Paydaşlardan\ther\tbiri\tkendi\tpayı\tbakımından\tmalik\thak\tve\tyükümlülüklerine\tsahip\tolur.\tPay\tdevredilebilir,\trehnedilebilir\tve\talacaklılar\ttarafından\thaczettirilebilir. \t 2.\tYönetim\tve\ttasarruf a.\tAnlaşmalar Madde\t 689-\tPaydaşlar,\t kendi\t aralarında\t oybirliğiyle\t anlaşarak\t yararlanma,\tkullanma\t ve\t yönetime\t ilişkin\t konularda\t kanun\t hükümlerinden\t farklı\t bir\t düzenleme\tyapabilirler.\t Ancak,\t böyle\t bir\t anlaşmayla\t paydaşların\t aşağıdaki\t hak\t ve\t yetkileri\tkaldırılamaz\tve\tsınırlandırılamaz: 1.\tPaylı\tmülkiyet\tkonusu\teşyanın\tkullanılabilirliğinin\tve\tdeğerinin\tkorunması\tiçin\tzorunlu\t olan\t yönetim\t işlerini\t yapmak\t ve\t gerektiğinde\t mahkemeden\t buna\t ilişkin\tönlemlerin\talınmasını\tistemek, 2.\t Eşyayı\t bir\t zarar\t tehlikesinden\t veya\t zararın\t artmasından\t korumak\t için\t derhâl\talınması\tgereken\tönlemleri\tbütün\tpaydaşlar\thesabına\talmak. Taşınmazlarla\t ilgili\t anlaşmalar\t imzalarının\t noterlikçe\t onaylanması\t koşuluyla\tpaydaşlardan\tbirinin\tbaşvurusu\tüzerine\ttapu\tkütüğüne\tşerh\tverilebilir. \t b.\tOlağan\työnetim\tişleri Madde\t 690-\tPaydaşlardan\t her\t biri\t olağan\t yönetim\t işlerini\t yapmaya,\t özellikle\tküçük\tonarımları\tyaptırmaya\tve\ttarımsal\tişleri\tyürütmeye\tyetkilidir. Zorunlu\tve\tivedi\tişlerin\tyapılmasına\tilişkin\tkanun\thükümleri\tsaklı\tkalmak\tkaydıyla,\tpaydaşların\t çoğunlukla\t alacağı\t kararla\t olağan\t yönetim\t işlerinde\t yetkiyle\t ilgili\t farklı\tdüzenleme\tgetirilebilir. \t c.\tÖnemli\työnetim\tişleri', 'B. Konut dokunulmazlığı Madde 21 – (Değişik: 3/10/2001-4709/6 md.) Kimsenin konutuna dokunulamaz. Millî güvenlik, kamu düzeni, suç işlenmesinin önlenmesi, genel sağlık ve genel ahlâkın korunması veya başkalarının hak ve özgürlüklerinin korunması sebeplerinden biri veya birkaçına bağlı olarak usulüne göre verilmiş hâkim kararı olmadıkça; yine bu sebeplere bağlı olarak gecikmesinde sakınca bulunan hallerde de kanunla yetkili kılınmış merciin yazılı emri bulunmadıkça; kimsenin konutuna girilemez, arama yapılamaz ve buradaki eşyaya el konulamaz. Yetkili merciin kararı yirmidört saat içinde görevli hâkimin onayına sunulur. Hâkim, kararını el koymadan itibaren kırksekiz saat içinde açıklar; aksi halde, el koyma kendiliğinden kalkar.  XII. Mülkiyet hakkı Madde 35 – Herkes, mülkiyet ve miras haklarına sahiptir. Bu haklar, ancak kamu yararı amacıyla, kanunla sınırlanabilir. Mülkiyet hakkının kullanılması toplum yararına aykırı olamaz.  A. Hak arama hürriyeti Madde 36 – Herkes, meşru vasıta ve yollardan faydalanmak suretiyle yargı mercileri önünde davacı veya davalı olarak iddia ve savunma ile adil yargılanma hakkına sahiptir.[16] Hiçbir mahkeme, görev ve yetkisi içindeki davaya bakmaktan kaçınamaz.  IV. Çalışma ve sözleşme hürriyeti Madde 48 – Herkes, dilediği alanda çalışma ve sözleşme hürriyetlerine sahiptir. Özel teşebbüsler kurmak serbesttir. Devlet, özel teşebbüslerin milli ekonominin gereklerine ve sosyal amaçlara uygun yürümesini, güvenlik ve kararlılık içinde çalışmasını sağlayacak tedbirleri alır.']","634 Sayılı Kat Mülkiyeti Kanunu Madde 737 uyarınca, herkes taşınmaz mülkiyetinden doğan yetkileri kullanırken komşularını olumsuz şekilde etkileyecek davranışlardan kaçınmakla yükümlüdür. Bu bağlamda, komşunuzun sürekli gürültü yapması ve kötü koku yayması, sizin yaşam alanınızı olumsuz etkileyen bir durumdur. Bu nedenle, komşunuzun bu davranışlarını düzeltmesi için yazılı bir ihtarda bulunabilir veya kat malikleri kuruluna başvurarak durumu bildirebilirsiniz. Eğer bu yollarla sorun çözülmezse, mahkemeye başvurarak komşunuzun bu davranışlarının durdurulmasını talep edebilirsiniz.","4721 Sayılı Türk Medeni Kanunu Madde 737 uyarınca, her malik komşularını olumsuz etkileyecek taşkınlıklardan (gürültü, koku, duman vb.) kaçınmakla yükümlüdür.",0.4,0.6062789604620188,0.37082335054638277
Polis veya yönetici evime izinsiz girebilir mi?,"['B. Konut dokunulmazlığı Madde 21 – (Değişik: 3/10/2001-4709/6 md.) Kimsenin konutuna dokunulamaz. Millî güvenlik, kamu düzeni, suç işlenmesinin önlenmesi, genel sağlık ve genel ahlâkın korunması veya başkalarının hak ve özgürlüklerinin korunması sebeplerinden biri veya birkaçına bağlı olarak usulüne göre verilmiş hâkim kararı olmadıkça; yine bu sebeplere bağlı olarak gecikmesinde sakınca bulunan hallerde de kanunla yetkili kılınmış merciin yazılı emri bulunmadıkça; kimsenin konutuna girilemez, arama yapılamaz ve buradaki eşyaya el konulamaz. Yetkili merciin kararı yirmidört saat içinde görevli hâkimin onayına sunulur. Hâkim, kararını el koymadan itibaren kırksekiz saat içinde açıklar; aksi halde, el koyma kendiliğinden kalkar.  XII. Mülkiyet hakkı Madde 35 – Herkes, mülkiyet ve miras haklarına sahiptir. Bu haklar, ancak kamu yararı amacıyla, kanunla sınırlanabilir. Mülkiyet hakkının kullanılması toplum yararına aykırı olamaz.  A. Hak arama hürriyeti Madde 36 – Herkes, meşru vasıta ve yollardan faydalanmak suretiyle yargı mercileri önünde davacı veya davalı olarak iddia ve savunma ile adil yargılanma hakkına sahiptir.[16] Hiçbir mahkeme, görev ve yetkisi içindeki davaya bakmaktan kaçınamaz.  IV. Çalışma ve sözleşme hürriyeti Madde 48 – Herkes, dilediği alanda çalışma ve sözleşme hürriyetlerine sahiptir. Özel teşebbüsler kurmak serbesttir. Devlet, özel teşebbüslerin milli ekonominin gereklerine ve sosyal amaçlara uygun yürümesini, güvenlik ve kararlılık içinde çalışmasını sağlayacak tedbirleri alır.']","Türkiye Cumhuriyeti Anayasası Madde 21 uyarınca, kimsenin konutuna izinsiz girilemez. Millî güvenlik, kamu düzeni, suç işlenmesinin önlenmesi gibi sebeplerle, usulüne göre verilmiş hâkim kararı olmadıkça veya gecikmesinde sakınca bulunan hallerde kanunla yetkili kılınmış merciin yazılı emri bulunmadıkça, polis veya yönetici gibi yetkililerin evinize izinsiz girmesi mümkün değildir.","Hayır. Türkiye Cumhuriyeti Anayasası Madde 21 uyarınca, hakim kararı veya kanunla yetkili kılınmış merciin yazılı emri olmadıkça kimsenin konutuna girilemez.",1.0,0.433512325006488,0.8489911812855608
